,score,comment
0,10.0,"The location is good, so it's easy to move after staying before staying
The price is fine
The staff were so kind
It's a pity that I just went to sleep because I checked in this time."
1,10.0,"The staff's response was kind, the room was clean and the water purifier was provided.
I applied for breakfast and ate it, but it has a lot of types and delicious taste."
2,10.0,"The friendly staff was a nice terrace, a clean facility, and it was the best place to be really satisfied with it!The father and the baby's medicine envelope was insane, so I mistaken it in a hotel trash bin, and the male staff went through all the garbage bags in a situation where I was busy with my original work.I would like to express my deepest gratitude for the goodwill of the male staff who helped me.Thanks to this, I was able to finish my first family trip with my baby.thank you !!"
3,10.0,"The convenience of the Premier Sweet Room was so great.Throughout the first visit, the best service and comfortable rooms have made me want to visit in the future.If you stay again in Jeju, you will book a sweet hotel and this room again."
4,10.0,"One of the 5 -star hotels in Jungmun Complex.The feeling of European sensibility boutique hotel.One of the reasons why the first floor with the terrace should go to this hotel.It is the best of the water purifier and the bidet because the teacher group acquired.If you go to Jeju next time, you will definitely use it again."
5,10.0,"From clean facilities to terrace views, I was also satisfied :) I was thrown into a hotel trash bin by mistake, but I was heartbroken because I couldn't find it again.However, the staff who knew this fact searched for all the trash can to find the baby and father's medicine bag.I would have been so busy enough for my original work, but I was really impressed with the good faith that the male staff gave me.Once again, I would like to express my deepest gratitude.thank you !"
6,10.0,"The location was good because it was Jungmun and the staff were kind.
It was a bed, but it was also good to be heated by the floor because it was floor.
I didn't ask for a humidifier and filled it with a clean humidifier.
It is a hotel because it is a place where you can use the microwave, but it was also good to heat baby food.
+ I went to the Shilla Hotel Park View evening buffet ... It was so close."
7,9.6,"Location is good and hotel condition is good
However, convenience facilities are far enough to drive out, and there is no other convenience store.
Breakfast is also a bit unfortunate for the price
Others like the hotel quiet, the pool is pretty and the staff is kind."
8,10.0,"There are many places to tour around, and there are many good places to walk and take a walk, so you can relax and sightseeing, and the items you really need are properly available."
9,10.0,"Since I entered the first floor, I was kind to the women's staff, and when I entered the room, I felt that it was luxurious and luxurious.All were clean and the bed was so soft that I was very satisfied.At night, Silla Lotte Hotel was nearby, so it was fun to look around.If you go a little car in the tourist complex, there are many restaurants in Olive Young Mart, and even if you go out, there are restaurants that are known in Jungmun.200%will be used again next time."
10,10.0,"The outdoor swimming pool is a picture, but it's close to Jungmun Beach!The nearby Olle trail is really good and the Cheonjiyeon Falls is also good."
11,10.0,"It was good to be able to stay at a 5 -star hotel at a good price at the Jungmun Tourism Complex.There were plenty of towels and amenities and it was good to clean the room cleaning while working.However, breakfast was somewhat poor for 5 stars.I stayed in Jeju City, and the food type or quality was compared with the business hotel."
12,10.0,"It was a corner concept room, which was suitable for four people.The location of the hostel was good, clean and the room service was excellent.I recommend it."
13,10.0,"There are more rooms for 3-4 people, and check-in checkouts are also a machine, but it is not difficult.It is in the Jungmun Hotel Complex, so it is good to move to the car.The fragrance in the hotel is very good and it's small, but it's good to have everything.First of all, I am very satisfied in terms of price."
14,10.0,"It's not like a hotel view, but it's clean and the staff are very friendly and soundproofing."
15,10.0,"Halla Mountain View was so good. The hotel itself is atmosphere!
In particular, the room condition is satisfactory, and when it was a lot of time, you can call you separately, so please prepare all the necessary parts."
16,9.6,"I came to Jeju Island several times and made my first visit to Jungmun, but I went to the hotel for the first time."
17,10.0,"I had a mother and three women stayed.
It's a room content that can be satisfied with a neat mother, and the bedding was comfortable.The bed is more comfortable than the double bed, so if you go with your parents if you go with your parents.I don't know if I am allocating the room, but it was quiet and the terrace was quiet."
18,10.0,"I use it again in summer
The staff are all kind!"
19,10.0,The staff were all kind and the room condition was good.
20,9.6,"Location -It's just next to the Shilla Hotel, so it's quiet and there's no restaurant or other facilities that you can walk, but if you move with a rental car, it's quiet (open until 12 o'clock in the hotel).

Room condition -It's a bit old, but it's very good to manage.There is a corridor or the next room noise, but it's not a problem here.

Breakfast -not excellent, but 26 400 won (20% discount on guests) is good for the price.

Staff -cheerful kindness.

Overall, it was a satisfactory stay."
21,10.0,"There are no hotels with rooms that can sleep with 4 people
It's the best to have a beer at night on the terrace."
22,9.6,"The bunker room was unusual, so the child really liked it.
I had a delivery food on the terrace and I had breakfast. There was a bus from the airport in front of the hotel."
23,10.0,"When I asked for a large bed, I was able to get a good night's sleep in a big bed, and most of all, the bed is so comfortable.No noise around"
24,10.0,Clean and friendly .... It was good .... I had a big heart and dinner.It's so delicious that I still want to eat again ...
25,10.0,"The swimming pool is close and the 5 -star hotel can be done for 100,000 won."
26,10.0,"I've been resting comfortably.
The bunker room is so popular on the second floor, so if you think about how to decide on the second floor, you can go in."
27,10.0,"It is located in Jungmun, so visiting tourist destinations as well as restaurants
The best location to visit."
28,10.0,"The staff were so kind and the breakfast was fine. But the inside of the hotel was a little narrow, there was no table. If you are a good business trip, it is a clean and good place to stay."
29,9.6,"Lotte Hotel Shilla Hotel is located nearby, so it is accessible to Jungmun or Seogwipo.
Unfortunately, the swimming pool is a bit small and it opens from 10 am. The small thing is inevitable, but the opening of the opening season, for example, from 7 am."
30,10.0,"The staff are too friendly
It's my second visit, but I'm going to go to Jeju again.
It's so good haha"
31,10.0,"This is the best location in Jungmun.
The room is tidy and especially in purification vocation
It was good to be able to use hygiene and water shortage when drinking ramen or coffee.
I was able to enjoy the Shilla Hotel Garden after eating at the Silla Hotel right in front of me.
The bus stop was close, so there was no inconvenience to use without rent."
32,10.0,There was a grass and the double bed bed was very pleasant.Satisfied with that alone.Small and comfortable hotel
33,10.0,"I made a reservation for my parents' birthday trip and accommodation, but the location was good and clean."
34,10.0,"I saw a review that breakfast is delicious, but I think the kind of food type and quality for the real price is so good.
If you have a chance to go next time, I think I'll choose because of breakfast ~ ^^"
35,9.6,"In Jungmun, I went to breakfast while only Shilla Hotel!Overseas feelings ~ The room service was all delicious, but the pizza was not so good."
36,10.0,"In fact, it's funny to be a 5 -star hotel, but it's so good and the best. I want to see the hotels around me."
37,10.0,It was so fun.The hot water pool is also excellent and the location and value for money are good.
38,10.0,"It was a good hotel for the family to stay.
The price was reasonable and the location was in Jungmun."
39,8.4,"Pool Villa was so good.
I think I'll use it again next time."
40,8.0,The location of the location was good.I like the bathroom.I want to visit again.
41,10.0,"I'm so satisfied
It was a cozy, kind and unfortunate day!I want to go again"
42,10.0,The accommodation was very clean and not complicated.I also liked the breakfast at night.
43,9.6,"I stayed in Jungmun with my parents and children, and it was really comfortable and enjoyable.However, the weather was so cold that I couldn't use the pool.The breakfast was satisfactory and the room hygiene was so clean and good.In particular, the children loved the bunker bed and were comfortable, so the couple+two children were satisfied!"
44,10.0,"The bedding is really warm and nice
After all, it was a 5 -star hotel 👍🏻
The view that I see when I open the window in the morning was wonderful
The location was also Jungmun, so it was okay to go here and there.
There was also a CU in front, so it was good to buy something.
The hot water pool didn't take a swimsuit and just watched it.
Even if you take a picture on the pool side, it's a photo zone.
It is pretty recommended 👍🏻👍🏻"
45,6.4,The kindness of the staff is felt from the front desk.I was welcoming with a bright smile .. I felt better with me.
46,10.0,"4 family
Family Bunk Room
This is the best accommodation in Jeju Island this week."
47,8.0,Not bad for the price
48,8.0,"I am comfortable with the cost of accommodation in the middle of 100,000 won.I like it because I have a staircase.
 In winter, I chose to enjoy outdoor water with warm hot water.

 Satisfaction"
49,8.0,great
50,10.0,"It's not far from the swimming pool, so you can move without much cold even though it was a winter trip.
Bunker beds and double beds were all comfortable
The terrace is not good to say, so the second round on the terrace ^^"
51,9.6,"It was a bad winter trip, but it was so good because there was a hot water pool.The staff are also kind and good!"
52,10.0,Clean facility friendly guide facilities are also satisfied with the comfort and pleasant trip.
53,10.0,"The location is next to Silla Lotte
It was good in the middle of Jungmun.

Thank you for the good service for the price for the price.
Especially the second floor bed is the best."
54,10.0,The staff were kind and the accommodation was clean!
55,7.2,"It's between a good hotel, so if you look at the hotel alone, it was just like that.
There is no merit compared to the price"
56,10.0,"Good price
Location good ..
Warm outdoor swimming pool good ..
Clean and comfortable rooms ..
I've been resting well."
57,10.0,I enjoy Jeju well with hot water pool.
58,10.0,"The children loved the double bed so much and for breakfast
The satisfaction was high.The pool hot water pool was also so fun.Even though it was cold, I couldn't feel the cold in the hot water pool.I want to use it next time."
59,10.0,"Bedding was good and breakfast was satisfactory ~
The location is also good, so I want to use it again next time !!"
60,10.0,It's a good value for swimming in the middle of winter.The facilities are clean and good.I want breakfast to be cheaper.
61,9.6,"In Jeju Island, there are many places that are already full, so I searched for the hotel.But 5 -star hotels were expensive and burdensome for 3 nights.I liked it because it was small but it was clean and had a swimming pool.The staff were also friendly!I think it's a place next time!"
62,9.6,"I used a family bunker room
The bunker bed was bigger than I thought, so it was so comfortable
Above all, it was good to have a terrace, and the water purifier installed in the room was really useful.
Bedding is also clean
The hotel itself was a low floor, so even if it was a single brewing, it was very good to rest quietly.
It's the first time to use the first floor room, but I have a lot of convenience.
The hot water pool was also good and until free use of Kabana
I really spent it."
63,8.8,"Thank you for the good service
I have spent a happy time with my family"
64,7.6,"I stayed in the terrace room on the first floor.
It's right next to the Shilla Hotel, so it's easy to go to the hills of the trail and Shri.
The location is so good and the price, but the hotel hygiene is unfortunate.
Hair was left on the check -in room desk and the pades were buried.
I changed my room, but this time I was surprised that there was a big pollution.
In the end, he changed the curtain, but the cleanliness management was unfortunate as a whole, but the staff's attitude was great."
65,10.0,"I really go to Jeju Island, but my family is going to Jeju Island."
66,10.0,I was so happy that the breakfast was delicious and the facilities were so good
67,10.0,"On a trip with Idul and the couple
Sweet accommodation makes beautiful memories
I gave you the winter, even though it was so good, I played for a while.sweet
It is completely recommended"
68,10.0,"It was clean and staff
You are all kind ~ Breakfast is over
It was delicious ~
I'm going to suite ♡ Recommended"
69,10.0,"Make a pledge
Return !!!"
70,10.0,"This is the best background open terrace
At the terrace table while looking at the scenery
Drinking coffee and stupid
It's winter, but breakfast buffet for hot water pools
It's very good ^^"
71,9.6,"Four -person family is not enough to stay.On the day of the blizzard, the water play in the hot water is a wonderful memory."
72,8.0,It was easy to attend and it was good to see the surroundings
73,10.0,It was a comfortable accommodation for friendly employees
74,10.0,I had a good time with the children and the mini hoc cass.
75,9.6,"I have a cozy room and a terrace (1st floor) and I stayed well at a beautiful hotel with a garden view with palm trees :)
The location is also located in Jungmun, and there is a convenience store next to it.
I stayed well last year and returned this year.Recommended if you are looking for a pretty hotel!"
76,10.0,The child is good to play
77,8.8,"The price is really good and the restaurant is delicious

But when it rains, the terrace room cannot be used.
It's a little unfortunate that I have to go to the Shilla Hotel because there is no electric car charging station."
78,10.0,"The room is slightly small but full.There is a bathtub in the bathroom, so I washed it well.Even if the bathtub structure was made well, it was good to take a long time because the water was cold and the breakfast was delicious.And even though it was winter, I used a hot water pool.I didn't know that it was cold, but I didn't take a swimsuit, but others would take it ㅠㅠ Jeju Island was 15 degrees and it was hot and it was worth it at night.The breakfast price was about 30,000 won per name."
79,10.0,Recommended as a child accommodation.
80,8.8,"The hot water was warm, so it was good to swim in the evening.It was good to have a free coupon event for katoklin pediatric breakfast."
81,10.0,It is a clean and facility hotel.All of the families were satisfied .... I am a doctor again.
82,10.0,"I booked for 4 nights and was similar to the nearby hotel
Everything is okay!Unfortunately, breakfast is worth breakfast
There is no food and the amenity is SOSO?!
There is no other than that.
Except when you're busy, please move the carrier baggage"
83,10.0,The staff were kind and the accommodation was good.
84,8.0,"I went on a family trip.
The water temperature was a bit cold because of the winter, but the water temperature was a bit cold."
85,9.6,"I was worried that I could sleep in one shot, but it was good to have a room for a reasonable price.It was recommended if the hotel was old and the hygiene was a little bad, but if you don't care about it and want a reasonable price."
86,10.0,It is a hotel that you want to give 1000 points out of 100 points out of 100 points.
87,8.0,great
88,9.2,"The location is good because it is Jungmun.The staff are also very friendly.The breakfast is worth eating, and it's a kind and comfortable atmosphere!Outdoor hot water grass is available and it was atmosphere and pretty in the evening!However, the bathroom is old and there are a lot of red water in many places, so the part is a lot."
89,10.0,"Next time, I visited when it was warm
I want to eat room service breakfast on the terrace"
90,10.0,It was a pretty hotel and a good price.
91,10.0,The hotel I used for the first time .. The location was good and the price was too merit.
92,9.2,"I am a family hotel accompanied by a child.
It is a good hotel because it operates winter hot water and can use the unusual room structure and terrace called bunker room.
In particular, the operation of the winter hot water was an important point in selecting the hotel, and the satisfaction was good.
However, there was a complaint in breakfast hygiene."
93,9.2,"I've been relaxing well
It's the best price"
94,7.2,"The bed was too low.The noise outside the door was severe.In general, the facility is underdeveloped"
95,10.0,"The hygiene is good and the bed has been so far that it was the best.
Next time, I want to come here again."
96,10.0,"The location was good, clean and friendly.The breakfast was a bit expensive, but I ate it well and I left an air pot."
97,10.0,"The employees who tried to immediately handle the inconvenience were always kind and the facilities were clean.Sometimes it was not soundproofed, but I could immediately move the room to spend the remaining schedule comfortably.There was also a beer/wine coupon that was provided free of charge to guests."
98,8.4,"It's a cold season, but it's really good at water.
And female staff.I was unhappy because I didn't know the name, but I was impressed by the hard work of working hard for customers and working as a positive mind.
I want to visit again next time"
99,10.0,"It's clean, soft and hot water, and it's good to have water pressure."
100,8.8,I have to stay afterwards.Employee response requires a new line
101,10.0,Good
102,10.0,"Winter trips to preliminary college students and parents are so happy to have a lot of memories in Jeju.
It's so pretty when the surrounding trails will be sunk.Lighting is fantasy.
It is a promenade with Lotte Hotel, so the night light is more beautiful."
103,10.0,The kids were also satisfied with the accommodation ^^ I like it because it is clean
104,5.2,"It has a strong scent that seems to hide the smell of something different, but it smells like a head."
105,9.6,It was the best location for the price.
106,7.2,"There was a long hair to open the body towel ... I had to wash my face and brush my teeth.There's something like a point in the bedding, so it's a moment?I did it, but it wasn't ;;;There was a fly flies in the bathroom bathtub.The atmosphere was good, but it was a bit unfortunate."
107,7.6,I am generally satisfied.
108,10.0,"It's a room condition, a price, and it's all very satisfied.It is God's Hansu to make a reservation with a family pool room.No matter how warm the water is, I was worried that the outdoor swimming would be difficult if the weather was cold.If you go to Jeju, the children will go to the same room again."
109,10.0,"It was a variety of breakfast and I ate it as soon as I opened it, and I was able to see the chefs who were busy moving to greet customers.It was Jungmun, so it was so good to visit Seogwipo and the west.The swimming pool was operated as a lukewarm pool."
110,9.2,"Separate from 4 families
But I made a reservation because I wanted to sleep in one shot.
It was a smoking cessation, but it smelled a bit in the curtain.
Perhaps it was a conscientious guest who used the room.
Elbe is fast and there is a convenience store right in front of me, and the info staff was so kind.I slept in the double floor, but the soundproofing was not slightly.Still, there were many restaurants nearby and the cafes were close and good"
111,10.0,"The location is so good.
It also provided breakfast for price and tasted good."
112,10.0,"Apply with Agoda and get a lot of discounts
It's very comfortable and clean"
113,8.4,"Masks in Jeju Island.Always stay in Jungmun.to do
Lotte.Silla.It's all.Expensive and room condition
just.I did.
first.location.price.I'm so satisfied.Room.situation.It's the best.Jungmun.Dinner and drink.Cold when I go out
The bus terminal.Before.there is.very
I was satisfied ~~
Jungmun.Sweet ^^"
114,9.6,"It was for two nights to be pleasant to welcome it with a fragrant scent.Thank you for reflecting your location and facilities quiet and 5 stars in Jungmun.Clean, clean and friendly.The breakfast was clean and fine.As a house wine event, a glass of wine in Lataberna on the first floor ~ The airport bus will be lowered in front of the hotel."
115,6.8,"The most friendly employee was the guard.You handled it neatly and quickly.When I checked in, the staff gathered and talked.Well, but it was not good for the first impression of the hotel, and in the meantime, I couldn't find the room with the wrong guidance of the staff and returned to the front of the front.
And it rained a lot at night, and the sound of the rain in the room was so big that I was so surprised that it was really bursting.It was really not good"
116,8.4,"The location is so good, but the facilities are limited"
117,10.0,"The staff are also friendly
The inside of the hotel was not noisy"
118,8.4,Generally satisfied
119,10.0,Review of business trip
120,10.0,I like the review of the review of the business trip
121,10.0,Review of business trip
122,8.0,You can play in the pool
123,3.6,"Most of the employees were not aware of the baby goods rental service and were very passive and mechanical.
The room condition was also located in Jungmun, so I didn't think of it."
124,9.2,"I had a good fitness in the morning and I had a curtain in the morning, so I could feel that the view of overseas travel is really a trip.The swimming pool was romantic air at night.I am satisfied"
125,9.6,"While I was living, the location of the hostel was all good, etc."
126,8.0,stayed here for one night as a couple. located in the main hotel area near joongmun  meaning 1)great for transportation 2) convenient bc you can use the restaurants of other hotels 3) close to a beach. room was great  very clean and airy. it was rainy an cold when we went so we couldn't enjoy the view  but would come back in the summer
127,8.0,I was grateful that guests came and caught in foreign countries.
128,9.2,"It would have been better if the weather was good, but the breakfast on the terrace was the best.It is recommended to stay on the terrace for about one day in Jeju.The bathroom is old.I have a doctor of return."
129,9.6,It was clean and uncomfortable.
130,9.6,"I feel like Jeju Island, and the amount is good and I liked the location so much."
131,2.0,The price for the price is not expensive
132,10.0,The property is so good and I like the surrounding location.
133,9.6,"However, I need to catch the smell of the toilet mold once
 In addition to the satisfaction"
134,10.0,"It was small but there was a two -layer bed, so it was not inconvenient to use three people."
135,8.8,It is good to stay in Jungmun and just stay without the use of additional facilities.
136,8.0,"It was a shame that Taras Buya was rumored to have a slightly neglected manage.Still, the viewdo restaurant Taras Rasfish is also a restaurant"
137,10.0,I was happy and happy !!
138,8.8,"The price is excellent in the Jungmun location
Inner hotel facility users are unfavorable (internal facilities are vulnerable compared to other Jungmun hotels-so the price is good)
Employees are kind
I am satisfied"
139,10.0,"No soundproofing
But the room condition and location were very good!"
140,9.6,Recommended terrace room!
141,9.2,"It's Jungmun, so it's convenient.The staff were kind to the neat accommodation, so I was satisfied for two days."
142,10.0,The location is so good and the accommodation is clean and fun.
143,9.2,Breakfast is a bit disappointing than other hotels
144,9.2,"Clean
The pool is warm, so there were quite a few people used at night"
145,8.8,Why is it an ambiguous position for 5 adults.The facility is simple and tidy.Luxury splendor Modern Instagram feelings.
146,8.8,"I used it for two nights and three days schedules with second -hand children.
It was neat and I lended the umbrella on a rainy day and greeted each employee.
There was nothing very uncomfortable because it was around the hostel.

I used a terrace room on the first floor with a bunker bed, but I slept alternately."
147,8.8,"It is true that it is old and dead when it comes to time.
However, the location is close and the hot water grass will be satisfied with children to adults."
148,9.2,"It is a place for our couple because it was a house that the child went back and forth when he was young.I still like it because it is cheaper, clean and friendly compared to the nearby hotels."
149,8.4,"Bedding and toilets were especially clean
It was a pity that the convenience facilities in the hotel were unfortunate."
150,10.0,I want to go again
151,8.0,"It's a hotel where my mom and daughter stayed for 2 days and 2 days.
I think I made a good choice.Mom liked it so much.
Employees are also kind and food that is made with room service
I ate well.This is the next place I want to go again.^-^/"
152,8.4,"The location is in the middle of the Jungmun complex, but it is an old building, so the room is remodeled and it's okay.Of course, you can use a good location at an affordable price."
