,score,comment
312,9.6,"I used a family bunker room
The bunker bed was bigger than I thought, so it was so comfortable
Above all, it was good to have a terrace, and the water purifier installed in the room was really useful.
Bedding is also clean
The hotel itself was a low floor, so even if it was a single brewing, it was very good to rest quietly.
It's the first time to use the first floor room, but I have a lot of convenience.
The hot water pool was also good and until free use of Kabana
I really spent it."
313,8.8,"Thank you for the good service
I have spent a happy time with my family"
314,7.6,"I stayed in the terrace room on the first floor.
It's right next to the Shilla Hotel, so it's easy to go to the hills of the trail and Shri.
The location is so good and the price, but the hotel hygiene is unfortunate.
Hair was left on the check -in room desk and the pades were buried.
I changed my room, but this time I was surprised that there was a big pollution.
In the end, he changed the curtain, but the cleanliness management was unfortunate as a whole, but the staff's attitude was great."
315,10.0,"I really go to Jeju Island, but my family is going to Jeju Island."
316,10.0,I was so happy that the breakfast was delicious and the facilities were so good
317,10.0,"On a trip with Idul and the couple
Sweet accommodation makes beautiful memories
I gave you the winter, even though it was so good, I played for a while.sweet
It is completely recommended"
318,10.0,"It was clean and staff
You are all kind ~ Breakfast is over
It was delicious ~
I'm going to suite ♡ Recommended"
319,10.0,"Make a pledge
Return !!!"
320,10.0,"This is the best background open terrace
At the terrace table while looking at the scenery
Drinking coffee and stupid
It's winter, but breakfast buffet for hot water pools
It's very good ^^"
321,9.6,"Four -person family is not enough to stay.On the day of the blizzard, the water play in the hot water is a wonderful memory."
322,8.0,It was easy to attend and it was good to see the surroundings
323,10.0,It was a comfortable accommodation for friendly employees
324,10.0,I had a good time with the children and the mini hoc cass.
325,9.6,"I have a cozy room and a terrace (1st floor) and I stayed well at a beautiful hotel with a garden view with palm trees :)
The location is also located in Jungmun, and there is a convenience store next to it.
I stayed well last year and returned this year.Recommended if you are looking for a pretty hotel!"
326,10.0,The child is good to play
327,8.8,"The price is really good and the restaurant is delicious

But when it rains, the terrace room cannot be used.
It's a little unfortunate that I have to go to the Shilla Hotel because there is no electric car charging station."
328,10.0,"The room is slightly small but full.There is a bathtub in the bathroom, so I washed it well.Even if the bathtub structure was made well, it was good to take a long time because the water was cold and the breakfast was delicious.And even though it was winter, I used a hot water pool.I didn't know that it was cold, but I didn't take a swimsuit, but others would take it ㅠㅠ Jeju Island was 15 degrees and it was hot and it was worth it at night.The breakfast price was about 30,000 won per name."
329,10.0,Recommended as a child accommodation.
330,8.8,"The hot water was warm, so it was good to swim in the evening.It was good to have a free coupon event for katoklin pediatric breakfast."
331,10.0,It is a clean and facility hotel.All of the families were satisfied .... I am a doctor again.
332,10.0,"I booked for 4 nights and was similar to the nearby hotel
Everything is okay!Unfortunately, breakfast is worth breakfast
There is no food and the amenity is SOSO?!
There is no other than that.
Except when you're busy, please move the carrier baggage"
333,10.0,The staff were kind and the accommodation was good.
334,8.0,"I went on a family trip.
The water temperature was a bit cold because of the winter, but the water temperature was a bit cold."
335,9.6,"I was worried that I could sleep in one shot, but it was good to have a room for a reasonable price.It was recommended if the hotel was old and the hygiene was a little bad, but if you don't care about it and want a reasonable price."
336,10.0,It is a hotel that you want to give 1000 points out of 100 points out of 100 points.
337,8.0,great
338,9.2,"The location is good because it is Jungmun.The staff are also very friendly.The breakfast is worth eating, and it's a kind and comfortable atmosphere!Outdoor hot water grass is available and it was atmosphere and pretty in the evening!However, the bathroom is old and there are a lot of red water in many places, so the part is a lot."
339,10.0,"Next time, I visited when it was warm
I want to eat room service breakfast on the terrace"
340,10.0,It was a pretty hotel and a good price.
341,10.0,The hotel I used for the first time .. The location was good and the price was too merit.
342,9.2,"I am a family hotel accompanied by a child.
It is a good hotel because it operates winter hot water and can use the unusual room structure and terrace called bunker room.
In particular, the operation of the winter hot water was an important point in selecting the hotel, and the satisfaction was good.
However, there was a complaint in breakfast hygiene."
343,9.2,"I've been relaxing well
It's the best price"
344,7.2,"The bed was too low.The noise outside the door was severe.In general, the facility is underdeveloped"
345,10.0,"The hygiene is good and the bed has been so far that it was the best.
Next time, I want to come here again."
346,10.0,"The location was good, clean and friendly.The breakfast was a bit expensive, but I ate it well and I left an air pot."
347,10.0,"The employees who tried to immediately handle the inconvenience were always kind and the facilities were clean.Sometimes it was not soundproofed, but I could immediately move the room to spend the remaining schedule comfortably.There was also a beer/wine coupon that was provided free of charge to guests."
348,8.4,"It's a cold season, but it's really good at water.
And female staff.I was unhappy because I didn't know the name, but I was impressed by the hard work of working hard for customers and working as a positive mind.
I want to visit again next time"
349,10.0,"It's clean, soft and hot water, and it's good to have water pressure."
350,8.8,I have to stay afterwards.Employee response requires a new line
351,10.0,Good
352,10.0,"Winter trips to preliminary college students and parents are so happy to have a lot of memories in Jeju.
It's so pretty when the surrounding trails will be sunk.Lighting is fantasy.
It is a promenade with Lotte Hotel, so the night light is more beautiful."
353,10.0,The kids were also satisfied with the accommodation ^^ I like it because it is clean
354,5.2,"It has a strong scent that seems to hide the smell of something different, but it smells like a head."
355,9.6,It was the best location for the price.
356,7.2,"There was a long hair to open the body towel ... I had to wash my face and brush my teeth.There's something like a point in the bedding, so it's a moment?I did it, but it wasn't ;;;There was a fly flies in the bathroom bathtub.The atmosphere was good, but it was a bit unfortunate."
357,7.6,I am generally satisfied.
358,10.0,"It's a room condition, a price, and it's all very satisfied.It is God's Hansu to make a reservation with a family pool room.No matter how warm the water is, I was worried that the outdoor swimming would be difficult if the weather was cold.If you go to Jeju, the children will go to the same room again."
359,10.0,"It was a variety of breakfast and I ate it as soon as I opened it, and I was able to see the chefs who were busy moving to greet customers.It was Jungmun, so it was so good to visit Seogwipo and the west.The swimming pool was operated as a lukewarm pool."
360,9.2,"Separate from 4 families
But I made a reservation because I wanted to sleep in one shot.
It was a smoking cessation, but it smelled a bit in the curtain.
Perhaps it was a conscientious guest who used the room.
Elbe is fast and there is a convenience store right in front of me, and the info staff was so kind.I slept in the double floor, but the soundproofing was not slightly.Still, there were many restaurants nearby and the cafes were close and good"
361,10.0,"The location is so good.
It also provided breakfast for price and tasted good."
362,10.0,"Apply with Agoda and get a lot of discounts
It's very comfortable and clean"
363,8.4,"Masks in Jeju Island.Always stay in Jungmun.to do
Lotte.Silla.It's all.Expensive and room condition
just.I did.
first.location.price.I'm so satisfied.Room.situation.It's the best.Jungmun.Dinner and drink.Cold when I go out
The bus terminal.Before.there is.very
I was satisfied ~~
Jungmun.Sweet ^^"
364,9.6,"It was for two nights to be pleasant to welcome it with a fragrant scent.Thank you for reflecting your location and facilities quiet and 5 stars in Jungmun.Clean, clean and friendly.The breakfast was clean and fine.As a house wine event, a glass of wine in Lataberna on the first floor ~ The airport bus will be lowered in front of the hotel."
365,6.8,"The most friendly employee was the guard.You handled it neatly and quickly.When I checked in, the staff gathered and talked.Well, but it was not good for the first impression of the hotel, and in the meantime, I couldn't find the room with the wrong guidance of the staff and returned to the front of the front.
And it rained a lot at night, and the sound of the rain in the room was so big that I was so surprised that it was really bursting.It was really not good"
366,8.4,"The location is so good, but the facilities are limited"
367,10.0,"The staff are also friendly
The inside of the hotel was not noisy"
368,8.4,Generally satisfied
369,10.0,Review of business trip
370,10.0,I like the review of the review of the business trip
371,10.0,Review of business trip
372,8.0,You can play in the pool
373,3.6,"Most of the employees were not aware of the baby goods rental service and were very passive and mechanical.
The room condition was also located in Jungmun, so I didn't think of it."
374,9.2,"I had a good fitness in the morning and I had a curtain in the morning, so I could feel that the view of overseas travel is really a trip.The swimming pool was romantic air at night.I am satisfied"
375,9.6,"While I was living, the location of the hostel was all good, etc."
376,8.0,stayed here for one night as a couple. located in the main hotel area near joongmun  meaning 1)great for transportation 2) convenient bc you can use the restaurants of other hotels 3) close to a beach. room was great  very clean and airy. it was rainy an cold when we went so we couldn't enjoy the view  but would come back in the summer
377,8.0,I was grateful that guests came and caught in foreign countries.
378,9.2,"It would have been better if the weather was good, but the breakfast on the terrace was the best.It is recommended to stay on the terrace for about one day in Jeju.The bathroom is old.I have a doctor of return."
379,9.6,It was clean and uncomfortable.
380,9.6,"I feel like Jeju Island, and the amount is good and I liked the location so much."
381,2.0,The price for the price is not expensive
382,10.0,The property is so good and I like the surrounding location.
383,9.6,"However, I need to catch the smell of the toilet mold once
 In addition to the satisfaction"
384,10.0,"It was small but there was a two -layer bed, so it was not inconvenient to use three people."
385,8.8,It is good to stay in Jungmun and just stay without the use of additional facilities.
386,8.0,"It was a shame that Taras Buya was rumored to have a slightly neglected manage.Still, the viewdo restaurant Taras Rasfish is also a restaurant"
387,10.0,I was happy and happy !!
388,8.8,"The price is excellent in the Jungmun location
Inner hotel facility users are unfavorable (internal facilities are vulnerable compared to other Jungmun hotels-so the price is good)
Employees are kind
I am satisfied"
389,10.0,"No soundproofing
But the room condition and location were very good!"
390,9.6,Recommended terrace room!
391,9.2,"It's Jungmun, so it's convenient.The staff were kind to the neat accommodation, so I was satisfied for two days."
392,10.0,The location is so good and the accommodation is clean and fun.
393,9.2,Breakfast is a bit disappointing than other hotels
394,9.2,"Clean
The pool is warm, so there were quite a few people used at night"
395,8.8,Why is it an ambiguous position for 5 adults.The facility is simple and tidy.Luxury splendor Modern Instagram feelings.
396,8.8,"I used it for two nights and three days schedules with second -hand children.
It was neat and I lended the umbrella on a rainy day and greeted each employee.
There was nothing very uncomfortable because it was around the hostel.

I used a terrace room on the first floor with a bunker bed, but I slept alternately."
397,8.8,"It is true that it is old and dead when it comes to time.
However, the location is close and the hot water grass will be satisfied with children to adults."
398,9.2,"It is a place for our couple because it was a house that the child went back and forth when he was young.I still like it because it is cheaper, clean and friendly compared to the nearby hotels."
399,8.4,"Bedding and toilets were especially clean
It was a pity that the convenience facilities in the hotel were unfortunate."
400,10.0,I want to go again
401,8.0,"It's a hotel where my mom and daughter stayed for 2 days and 2 days.
I think I made a good choice.Mom liked it so much.
Employees are also kind and food that is made with room service
I ate well.This is the next place I want to go again.^-^/"
402,8.4,"The location is in the middle of the Jungmun complex, but it is an old building, so the room is remodeled and it's okay.Of course, you can use a good location at an affordable price."
403,9.2,"All folded terrace and bunker bed on the second floor.Sweet hotel decided to look at the terrace breakfast room service setting.It was not so large and the facilities were concise and good.
The employees are all kind and the hotel is good.
The first floor with the children and the terrace, so it was easy and cozy to use the pool mini library."
404,9.2,"There are 5 -star hotels in the surrounding area, so the comparison is a bit comparable, but I went too well in terms of price.
It's small with the pool, so it's good for children to play.
The bedding was clean and good"
405,7.2,"The location is good.
But there is not enough facilities to go with children
I went to Kidsbang, but I only have a book
I think there is a slide swimming pool.
And the sitting part is dirty
People are empty in the snack bar.
When checking in, the person who checks in the desk was not so kind.
It was good when I came out with Chak out to me.
The cleaning state is a bug and a toothpick?There was the same thing ㅠ The bug was in the bathroom ...
I don't think it's because it's the first floor"
406,10.0,"The children liked it because it was a double floor
The bed is spacious and comfortable
It is also good to use the pool"
407,10.0,This is a good value for money.
408,10.0,Location price facilities were all good.
409,6.4,"First of all, Private Pool was good.

The private pool is on the first floor, which is inconvenient due to the upstairs guests.
And it is a problem because people who smoke throw the cigarette butts on the first floor.

The room condition in the family room is not good.The smell of humid is so severe that you can't sleep.

Breakfast room service is satisfactory, inexpensive and suitable."
410,10.0,"I met seven years, but Jeju Island was the first time.:)"
411,10.0,It was good to be able to take pictures beautifully in a private pool or a cute room in front of the room.
412,10.0,Quiet and good atmosphere.
413,7.6,"It's been a few hours since I entered, but it's still hot, so I contacted the front front and check if the balcony door was closed well ...
If the balcony door is open, the air conditioner doesn't work ???

Every time it is hot, the balcony door is closed, so I opened the balcony door again and closed it.
Even if the air -conditioning wind comes out, it doesn't make it cool because it comes out.

As I checked out, I saw a fan in another room.There's a real thing ...
It was hot when I had breakfast in the morning ..
Is it because the facility is old ... ha ... it's not midsummer, but it's hot!

The staff were kind.
I don't think I will visit again."
414,8.0,great place  easy to walk around the neighborhood  rooms are quite dark and humid. cleaning could be done better. staffs are very welcoming and kind.
415,10.0,"I've been resting well.
The pool is not big, but I sent it comfortably"
416,8.0,It would be nice to take the pool or Kabana with the children.
417,6.0,"I thought it was a good hotel in the past, so I went back to the past.However, the employees' services were kind.However, the facility was not undergoing.How about changing the curtain color ..."
418,9.2,"The location is so good.There is also a promenade and parents
You liked it so much.Breakfast is also diverse and good"
419,10.0,"I went to three friends, but the bed was good.
Room service price was so good ~!"
420,10.0,"The best hotel for the price, especially the terrace"
421,10.0,The warm response of the staff was good.
422,2.4,"Sanitary condition is good.
Breakfast was also delicious.
I'm going to visit again when I travel."
423,8.8,"I went to the terrace ha, but I didn't really regret it."
424,6.8,"Four families (including youth) are too narrow.It's hot, so it's hard to use the terrace."
425,10.0,Good cleanliness and location
426,8.8,It was so hot and humid that it was not used.Look at the weather and make a reservation
427,9.6,"It was smaller than Silla and Lotte, but it was good because it was cute and exotic."
428,9.2,The employee's response is fast and friendly. I was assigned to the rooms that I asked before the accommodation and I asked one more room for the room.
429,10.0,"It's good to use restaurants nearby, clean rooms and views are so good!"
430,6.4,"Because I talked backwards if I should go to the front defense
I went up and down ㅡ ㅡ
The family is narrow and the room is narrow."
431,6.0,"I don't think I'll go twice
The staff's explanation is not too sincerity"
432,8.8,"The facilities such as the pool gym are not priced.
Nearly 4-5 pyeong of the gym?It is difficult to enjoy well because there are two kinds of running at the extent and the pool has a lot of babies.

but!!!
I must be a room with a terrace
Because the terrace is pretty…🫰"
433,9.2,"It was so good that it didn't cost for the pool and health.The breakfast is also clean, so it tasted.I think it was just the best for rest."
434,6.0,"I knew it was an old facility, but it was a pity to clean up
Bathroom drainage hair."
435,7.2,"It is a good hotel among the Chinese luxury hotels
Used in the past and was okay
I decided to go to this trip
Running to the level of running almost from above
Thanks to the guests, in a narrow and stuffy room at 11 pm
I moved to Buryaburya, but I have already run away
I couldn't relax on my tired trip.

In the early evening, I told the staff that there was noise between floors.
The guests are at all
I don't know if there was no courtesy
I don't think I'm going to use it again because I am disappointed this time."
436,8.4,"I was in a hurry with a family trip, but it's not bad."
437,10.0,It is the best for families to use
438,10.0,The rooms are also wider than the average hotels.
439,6.4,"I came with a friend, but it wasn't as luxurious than I thought."
440,9.2,It's clean and the atmosphere is so good compared to the year
441,10.0,It is the best price -effective 5 -star hotel between Lotte and Shilla Hotel.Both swimming breakfast accommodation is satisfactory.
442,8.0,The pool is a bit old
443,10.0,The service is satisfied.Breakfast seems to be a taste difference!
444,4.8,"I was really unpleasant in the attitude of instructions.
Do I stay in this hotel?
I had a kiosk, so I thought I was self -checking in and went forward.
Why should I pay for it?
The female employee was really kind.
Men's staff (who are old) are the basic at the hotel.
I've noticed a few times, but I think it's too bad.
Giving money and noticing the staff .. ^^"
445,9.2,dot
446,9.2,"There was a bunker bed, so it was good to sleep
The terrace was really the advantage.
It was a pity that I couldn't use the terrace on a rainy day
I was very satisfied with the terrace reporting."
447,8.0,"I am disappointed because it is too expected
In fact, I didn't expect the Shilla Hotel class
Restaurant restaurants, etc.
Too too ...
No re -examination."
448,8.4,It's not bad overall
449,2.0,"There are not one or two problems.I couldn't believe this was 5 stars.It's a room with my children, but I was surprised because there was a glass debris on the terrace.What if the kids stepped on?The stains were not managed at all, and the bedding was so damp that it was too damp.In spite of the front, the room moved.Besides, breakfast was more ridiculous.I told you that the herbs were fifty, and the chef said that it tastes good.The chef who says that or a staff who convey it…It was the worst.I think it's just a good job for foreigners.It's just a good value.Employees' attitudes are as good as a luxury hotel.It doesn't suit you."
450,10.0,"The hygiene is clean, the staff are friendly, and it's good to go with the child !!"
451,10.0,"Room condition location service interior is all satisfied.
The hotel is small and pretty."
452,8.0,"If you use the spring autumn terrace room, it seems like you're camping.
But the facility is old"
453,10.0,"I put Jeju as a new day, but the hotel is so good."
454,8.0,"There is a water purifier, so you can understand that you don't have a refrigerator, but it's a bit like a water purifier that comes out with cold water.Other facilities were good, so there was no big inconvenience."
455,4.0,"There was a smell of squeezing in the cafe, and the bathroom was the same."
456,9.6,It's on the Jungmun side and right next to the Shilla Hotel!It is also good to walk and overall facilities are good.
457,8.8,"It is a cheap hotel in Jungmun Complex.
It's good to stay and walk around the Shilla Hotel Parnas.But the cleaning state is sad."
458,7.2,"Duplex rooms were good to stay, and the child liked it because of the stairs.It was just because the floor was carpet and it wasn't a bit clean.I didn't use the facilities for only one night.The terrace scenery was pretty and the staff were kind."
459,9.6,"It is a place where you can return to visit, but both locations and facilities are good."
460,7.6,"The location was good and the room condition was good and the whole is satisfied
However, the staff unknowing when check -in.
The staff were kind during check -out."
461,10.0,The location is good and the inside of the hostel is clean and good
462,9.2,"The hotel is clean and located and the use is so convenient.Next to the Shilla Hotel, you can use the Shilla Hotel meals, walk the garden, go to Jungmun Sea, and are satisfied in many ways."
463,9.6,It was good to be quiet because the hotel was quiet and relaxed.
464,9.6,It was so good ㅎㅎ There are various hotels nearby and the facility Du Good Good
465,10.0,Terrace room is clean and satisfied
466,9.6,It was comfortable and good because there were two large beds with the double floor.It was good to have one TV for each bed.
467,8.4,"Depending on the room, the view can be seen and the pool is narrow.The location is okay in the Chinese gate"
468,10.0,I rested really comfortably ^^
469,10.0,great
470,7.6,"The facilities for the price for the price were aging, especially the toilet toilet toilet/bathtub drainage, so I could not use it smoothly.I called the administrator in the middle, but the next day happened again.I think you should pay more attention to the facility."
471,7.6,"The terrace is good, but it is a pity that there is a lack of facilities.The interior of the interior is also needed to suit the grade.I couldn't sleep comfortably with male guests who were not soundproofed, so I moved the room."
472,10.0,"It is next to the Shilla Hotel, clean and reasonable."
473,8.4,Great accommodation.Pretty bathtub.Spacious living room
474,5.2,"I made a reservation after seeing the review ... I was a little disappointed.
The interior frames were put on the shelf behind the bed ...
The dust is piled up between the frames.
If you don't think it's going to be managed, it's better to leave it away without such props.
Really .... ㅠㅠ
The places you see are neat places"
475,8.4,great
476,7.6,"Location is good.I stayed in a double -layered room, but I felt a little small, but there was no problem with an adult 3 child.It was a bit unfortunate that there was no indoor swimming pool, but I think it's a good hotel."
477,10.0,"It is a neat place without a lot.
I recommend it"
478,8.4,It is good to use when the weather is good.
479,10.0,The price is good and the room condition is good
480,10.0,The room is spacious and clean
481,10.0,"A place where you stayed because of the terrace !!There was a terrace on the side of the car, but it was a bit embarrassed, but it was so nice to buy it at the hostel and come to play !!"
482,10.0,"After traveling at Robbian Pub, a glass of beer is tired
The breakfast was also delicious
I loved the bedding so well."
483,8.4,"Clean and good location .. It is small and old
I rested comfortably"
484,10.0,The bedding and cleaning staff were kind and everyone was satisfied.
