,score,comment
153,9.2,"All folded terrace and bunker bed on the second floor.Sweet hotel decided to look at the terrace breakfast room service setting.It was not so large and the facilities were concise and good.
The employees are all kind and the hotel is good.
The first floor with the children and the terrace, so it was easy and cozy to use the pool mini library."
154,9.2,"There are 5 -star hotels in the surrounding area, so the comparison is a bit comparable, but I went too well in terms of price.
It's small with the pool, so it's good for children to play.
The bedding was clean and good"
155,7.2,"The location is good.
But there is not enough facilities to go with children
I went to Kidsbang, but I only have a book
I think there is a slide swimming pool.
And the sitting part is dirty
People are empty in the snack bar.
When checking in, the person who checks in the desk was not so kind.
It was good when I came out with Chak out to me.
The cleaning state is a bug and a toothpick?There was the same thing ㅠ The bug was in the bathroom ...
I don't think it's because it's the first floor"
156,10.0,"The children liked it because it was a double floor
The bed is spacious and comfortable
It is also good to use the pool"
157,10.0,This is a good value for money.
158,10.0,Location price facilities were all good.
159,6.4,"First of all, Private Pool was good.

The private pool is on the first floor, which is inconvenient due to the upstairs guests.
And it is a problem because people who smoke throw the cigarette butts on the first floor.

The room condition in the family room is not good.The smell of humid is so severe that you can't sleep.

Breakfast room service is satisfactory, inexpensive and suitable."
160,10.0,"I met seven years, but Jeju Island was the first time.:)"
161,10.0,It was good to be able to take pictures beautifully in a private pool or a cute room in front of the room.
162,10.0,Quiet and good atmosphere.
163,7.6,"It's been a few hours since I entered, but it's still hot, so I contacted the front front and check if the balcony door was closed well ...
If the balcony door is open, the air conditioner doesn't work ???

Every time it is hot, the balcony door is closed, so I opened the balcony door again and closed it.
Even if the air -conditioning wind comes out, it doesn't make it cool because it comes out.

As I checked out, I saw a fan in another room.There's a real thing ...
It was hot when I had breakfast in the morning ..
Is it because the facility is old ... ha ... it's not midsummer, but it's hot!

The staff were kind.
I don't think I will visit again."
164,8.0,great place  easy to walk around the neighborhood  rooms are quite dark and humid. cleaning could be done better. staffs are very welcoming and kind.
165,10.0,"I've been resting well.
The pool is not big, but I sent it comfortably"
166,8.0,It would be nice to take the pool or Kabana with the children.
167,6.0,"I thought it was a good hotel in the past, so I went back to the past.However, the employees' services were kind.However, the facility was not undergoing.How about changing the curtain color ..."
168,9.2,"The location is so good.There is also a promenade and parents
You liked it so much.Breakfast is also diverse and good"
169,10.0,"I went to three friends, but the bed was good.
Room service price was so good ~!"
170,10.0,"The best hotel for the price, especially the terrace"
171,10.0,The warm response of the staff was good.
172,2.4,"Sanitary condition is good.
Breakfast was also delicious.
I'm going to visit again when I travel."
173,8.8,"I went to the terrace ha, but I didn't really regret it."
174,6.8,"Four families (including youth) are too narrow.It's hot, so it's hard to use the terrace."
175,10.0,Good cleanliness and location
176,8.8,It was so hot and humid that it was not used.Look at the weather and make a reservation
177,9.6,"It was smaller than Silla and Lotte, but it was good because it was cute and exotic."
178,9.2,The employee's response is fast and friendly. I was assigned to the rooms that I asked before the accommodation and I asked one more room for the room.
179,10.0,"It's good to use restaurants nearby, clean rooms and views are so good!"
180,6.4,"Because I talked backwards if I should go to the front defense
I went up and down ㅡ ㅡ
The family is narrow and the room is narrow."
181,6.0,"I don't think I'll go twice
The staff's explanation is not too sincerity"
182,8.8,"The facilities such as the pool gym are not priced.
Nearly 4-5 pyeong of the gym?It is difficult to enjoy well because there are two kinds of running at the extent and the pool has a lot of babies.

but!!!
I must be a room with a terrace
Because the terrace is pretty…🫰"
183,9.2,"It was so good that it didn't cost for the pool and health.The breakfast is also clean, so it tasted.I think it was just the best for rest."
184,6.0,"I knew it was an old facility, but it was a pity to clean up
Bathroom drainage hair."
185,7.2,"It is a good hotel among the Chinese luxury hotels
Used in the past and was okay
I decided to go to this trip
Running to the level of running almost from above
Thanks to the guests, in a narrow and stuffy room at 11 pm
I moved to Buryaburya, but I have already run away
I couldn't relax on my tired trip.

In the early evening, I told the staff that there was noise between floors.
The guests are at all
I don't know if there was no courtesy
I don't think I'm going to use it again because I am disappointed this time."
186,8.4,"I was in a hurry with a family trip, but it's not bad."
187,10.0,It is the best for families to use
188,10.0,The rooms are also wider than the average hotels.
189,6.4,"I came with a friend, but it wasn't as luxurious than I thought."
190,9.2,It's clean and the atmosphere is so good compared to the year
191,10.0,It is the best price -effective 5 -star hotel between Lotte and Shilla Hotel.Both swimming breakfast accommodation is satisfactory.
192,8.0,The pool is a bit old
193,10.0,The service is satisfied.Breakfast seems to be a taste difference!
194,4.8,"I was really unpleasant in the attitude of instructions.
Do I stay in this hotel?
I had a kiosk, so I thought I was self -checking in and went forward.
Why should I pay for it?
The female employee was really kind.
Men's staff (who are old) are the basic at the hotel.
I've noticed a few times, but I think it's too bad.
Giving money and noticing the staff .. ^^"
195,9.2,dot
196,9.2,"There was a bunker bed, so it was good to sleep
The terrace was really the advantage.
It was a pity that I couldn't use the terrace on a rainy day
I was very satisfied with the terrace reporting."
197,8.0,"I am disappointed because it is too expected
In fact, I didn't expect the Shilla Hotel class
Restaurant restaurants, etc.
Too too ...
No re -examination."
198,8.4,It's not bad overall
199,2.0,"There are not one or two problems.I couldn't believe this was 5 stars.It's a room with my children, but I was surprised because there was a glass debris on the terrace.What if the kids stepped on?The stains were not managed at all, and the bedding was so damp that it was too damp.In spite of the front, the room moved.Besides, breakfast was more ridiculous.I told you that the herbs were fifty, and the chef said that it tastes good.The chef who says that or a staff who convey it…It was the worst.I think it's just a good job for foreigners.It's just a good value.Employees' attitudes are as good as a luxury hotel.It doesn't suit you."
200,10.0,"The hygiene is clean, the staff are friendly, and it's good to go with the child !!"
201,10.0,"Room condition location service interior is all satisfied.
The hotel is small and pretty."
202,8.0,"If you use the spring autumn terrace room, it seems like you're camping.
But the facility is old"
203,10.0,"I put Jeju as a new day, but the hotel is so good."
204,8.0,"There is a water purifier, so you can understand that you don't have a refrigerator, but it's a bit like a water purifier that comes out with cold water.Other facilities were good, so there was no big inconvenience."
205,4.0,"There was a smell of squeezing in the cafe, and the bathroom was the same."
206,9.6,It's on the Jungmun side and right next to the Shilla Hotel!It is also good to walk and overall facilities are good.
207,8.8,"It is a cheap hotel in Jungmun Complex.
It's good to stay and walk around the Shilla Hotel Parnas.But the cleaning state is sad."
208,7.2,"Duplex rooms were good to stay, and the child liked it because of the stairs.It was just because the floor was carpet and it wasn't a bit clean.I didn't use the facilities for only one night.The terrace scenery was pretty and the staff were kind."
209,9.6,"It is a place where you can return to visit, but both locations and facilities are good."
210,7.6,"The location was good and the room condition was good and the whole is satisfied
However, the staff unknowing when check -in.
The staff were kind during check -out."
211,10.0,The location is good and the inside of the hostel is clean and good
212,9.2,"The hotel is clean and located and the use is so convenient.Next to the Shilla Hotel, you can use the Shilla Hotel meals, walk the garden, go to Jungmun Sea, and are satisfied in many ways."
213,9.6,It was good to be quiet because the hotel was quiet and relaxed.
214,9.6,It was so good ㅎㅎ There are various hotels nearby and the facility Du Good Good
215,10.0,Terrace room is clean and satisfied
216,9.6,It was comfortable and good because there were two large beds with the double floor.It was good to have one TV for each bed.
217,8.4,"Depending on the room, the view can be seen and the pool is narrow.The location is okay in the Chinese gate"
218,10.0,I rested really comfortably ^^
219,10.0,great
220,7.6,"The facilities for the price for the price were aging, especially the toilet toilet toilet/bathtub drainage, so I could not use it smoothly.I called the administrator in the middle, but the next day happened again.I think you should pay more attention to the facility."
221,7.6,"The terrace is good, but it is a pity that there is a lack of facilities.The interior of the interior is also needed to suit the grade.I couldn't sleep comfortably with male guests who were not soundproofed, so I moved the room."
222,10.0,"It is next to the Shilla Hotel, clean and reasonable."
223,8.4,Great accommodation.Pretty bathtub.Spacious living room
224,5.2,"I made a reservation after seeing the review ... I was a little disappointed.
The interior frames were put on the shelf behind the bed ...
The dust is piled up between the frames.
If you don't think it's going to be managed, it's better to leave it away without such props.
Really .... ㅠㅠ
The places you see are neat places"
225,8.4,great
226,7.6,"Location is good.I stayed in a double -layered room, but I felt a little small, but there was no problem with an adult 3 child.It was a bit unfortunate that there was no indoor swimming pool, but I think it's a good hotel."
227,10.0,"It is a neat place without a lot.
I recommend it"
228,8.4,It is good to use when the weather is good.
229,10.0,The price is good and the room condition is good
230,10.0,The room is spacious and clean
231,10.0,"A place where you stayed because of the terrace !!There was a terrace on the side of the car, but it was a bit embarrassed, but it was so nice to buy it at the hostel and come to play !!"
232,10.0,"After traveling at Robbian Pub, a glass of beer is tired
The breakfast was also delicious
I loved the bedding so well."
233,8.4,"Clean and good location .. It is small and old
I rested comfortably"
234,10.0,The bedding and cleaning staff were kind and everyone was satisfied.
235,8.8,"Our couple living in Jeju Island sometimes stays in Jeju Hotels and stays in Jeju.Sweet Hotel Jeju Premier Sweet Room ~~ When check -in, the staff were very kind and the room was spacious and clean than expected. The bathroom had a bathtub and a shower booth and a large bathroom.For us who liked it, I couldn't sleep because it was a lot of honey, but the bedding was soft and clean.However, there was a lot of dust in the gap next to the refrigerator, which is not easy to reach.If you talk to the front just before 9 o'clock the day before, it helps to choose a breakfast at a discounted price next day.It was a pity that two pages of rudder and baked vegetables ate 60,000 won were a bit unfortunate ~~ And check -in event free drink coupons.I didn't receive it ~ In general, I liked the most was a large room."
236,6.0,"I used a lot before Corona
It is not good compared to the old days."
237,9.6,"The staff are also kind, clean and quiet"
238,10.0,The terrace room condition was the best and the atmosphere was good.
239,10.0,"It's a great accommodation located between Shilla Hotel and Lotte Hotel.
Sit on the terrace and enjoy breakfast room service.
This is recommended!"
240,8.0,"Everything was fine, such as location, but the facilities are a bit unfortunate."
241,8.4,"It's a location, so it's a Jungmun complex.
If you don't like to be fluffy in a hard bed, Goryeo is Goryeo ^. ^"
242,8.0,"The two -story bed and double beds were composed of a woman's net, and there was a terrace in front of you, so it was good to feel brunchy because it was a room service."
243,7.6,"I stayed for three people, but I was very comfortable."
244,8.8,"Good value for money and kindness
It is convenient because it is located in Jungmun"
245,10.0,Quiet and distant.I slept here.
246,8.0,You can also enjoy the water play and the room service breakfast is fantasy on the first floor.
247,10.0,It's a price -based hotel.The staff were also kind and breakfast was fine and so good
248,6.4,The toilet shower room facility
249,10.0,"There are a lot of terrace worms, but it's good to walk and bunker room good"
250,10.0,"The location is good, so it's easy to move after staying before staying
The price is fine
The staff were so kind
It's a pity that I just went to sleep because I checked in this time."
251,10.0,"The staff's response was kind, the room was clean and the water purifier was provided.
I applied for breakfast and ate it, but it has a lot of types and delicious taste."
252,10.0,"The friendly staff was a nice terrace, a clean facility, and it was the best place to be really satisfied with it!The father and the baby's medicine envelope was insane, so I mistaken it in a hotel trash bin, and the male staff went through all the garbage bags in a situation where I was busy with my original work.I would like to express my deepest gratitude for the goodwill of the male staff who helped me.Thanks to this, I was able to finish my first family trip with my baby.thank you !!"
253,10.0,"The convenience of the Premier Sweet Room was so great.Throughout the first visit, the best service and comfortable rooms have made me want to visit in the future.If you stay again in Jeju, you will book a sweet hotel and this room again."
254,10.0,"One of the 5 -star hotels in Jungmun Complex.The feeling of European sensibility boutique hotel.One of the reasons why the first floor with the terrace should go to this hotel.It is the best of the water purifier and the bidet because the teacher group acquired.If you go to Jeju next time, you will definitely use it again."
255,10.0,"From clean facilities to terrace views, I was also satisfied :) I was thrown into a hotel trash bin by mistake, but I was heartbroken because I couldn't find it again.However, the staff who knew this fact searched for all the trash can to find the baby and father's medicine bag.I would have been so busy enough for my original work, but I was really impressed with the good faith that the male staff gave me.Once again, I would like to express my deepest gratitude.thank you !"
256,10.0,"The location was good because it was Jungmun and the staff were kind.
It was a bed, but it was also good to be heated by the floor because it was floor.
I didn't ask for a humidifier and filled it with a clean humidifier.
It is a hotel because it is a place where you can use the microwave, but it was also good to heat baby food.
+ I went to the Shilla Hotel Park View evening buffet ... It was so close."
257,9.6,"Location is good and hotel condition is good
However, convenience facilities are far enough to drive out, and there is no other convenience store.
Breakfast is also a bit unfortunate for the price
Others like the hotel quiet, the pool is pretty and the staff is kind."
258,10.0,"There are many places to tour around, and there are many good places to walk and take a walk, so you can relax and sightseeing, and the items you really need are properly available."
259,10.0,"Since I entered the first floor, I was kind to the women's staff, and when I entered the room, I felt that it was luxurious and luxurious.All were clean and the bed was so soft that I was very satisfied.At night, Silla Lotte Hotel was nearby, so it was fun to look around.If you go a little car in the tourist complex, there are many restaurants in Olive Young Mart, and even if you go out, there are restaurants that are known in Jungmun.200%will be used again next time."
260,10.0,"The outdoor swimming pool is a picture, but it's close to Jungmun Beach!The nearby Olle trail is really good and the Cheonjiyeon Falls is also good."
261,10.0,"It was good to be able to stay at a 5 -star hotel at a good price at the Jungmun Tourism Complex.There were plenty of towels and amenities and it was good to clean the room cleaning while working.However, breakfast was somewhat poor for 5 stars.I stayed in Jeju City, and the food type or quality was compared with the business hotel."
262,10.0,"It was a corner concept room, which was suitable for four people.The location of the hostel was good, clean and the room service was excellent.I recommend it."
263,10.0,"There are more rooms for 3-4 people, and check-in checkouts are also a machine, but it is not difficult.It is in the Jungmun Hotel Complex, so it is good to move to the car.The fragrance in the hotel is very good and it's small, but it's good to have everything.First of all, I am very satisfied in terms of price."
264,10.0,"It's not like a hotel view, but it's clean and the staff are very friendly and soundproofing."
265,10.0,"Halla Mountain View was so good. The hotel itself is atmosphere!
In particular, the room condition is satisfactory, and when it was a lot of time, you can call you separately, so please prepare all the necessary parts."
266,9.6,"I came to Jeju Island several times and made my first visit to Jungmun, but I went to the hotel for the first time."
267,10.0,"I had a mother and three women stayed.
It's a room content that can be satisfied with a neat mother, and the bedding was comfortable.The bed is more comfortable than the double bed, so if you go with your parents if you go with your parents.I don't know if I am allocating the room, but it was quiet and the terrace was quiet."
268,10.0,"I use it again in summer
The staff are all kind!"
269,10.0,The staff were all kind and the room condition was good.
270,9.6,"Location -It's just next to the Shilla Hotel, so it's quiet and there's no restaurant or other facilities that you can walk, but if you move with a rental car, it's quiet (open until 12 o'clock in the hotel).

Room condition -It's a bit old, but it's very good to manage.There is a corridor or the next room noise, but it's not a problem here.

Breakfast -not excellent, but 26 400 won (20% discount on guests) is good for the price.

Staff -cheerful kindness.

Overall, it was a satisfactory stay."
271,10.0,"There are no hotels with rooms that can sleep with 4 people
It's the best to have a beer at night on the terrace."
272,9.6,"The bunker room was unusual, so the child really liked it.
I had a delivery food on the terrace and I had breakfast. There was a bus from the airport in front of the hotel."
273,10.0,"When I asked for a large bed, I was able to get a good night's sleep in a big bed, and most of all, the bed is so comfortable.No noise around"
274,10.0,Clean and friendly .... It was good .... I had a big heart and dinner.It's so delicious that I still want to eat again ...
275,10.0,"The swimming pool is close and the 5 -star hotel can be done for 100,000 won."
276,10.0,"I've been resting comfortably.
The bunker room is so popular on the second floor, so if you think about how to decide on the second floor, you can go in."
277,10.0,"It is located in Jungmun, so visiting tourist destinations as well as restaurants
The best location to visit."
278,10.0,"The staff were so kind and the breakfast was fine. But the inside of the hotel was a little narrow, there was no table. If you are a good business trip, it is a clean and good place to stay."
279,9.6,"Lotte Hotel Shilla Hotel is located nearby, so it is accessible to Jungmun or Seogwipo.
Unfortunately, the swimming pool is a bit small and it opens from 10 am. The small thing is inevitable, but the opening of the opening season, for example, from 7 am."
280,10.0,"The staff are too friendly
It's my second visit, but I'm going to go to Jeju again.
It's so good haha"
281,10.0,"This is the best location in Jungmun.
The room is tidy and especially in purification vocation
It was good to be able to use hygiene and water shortage when drinking ramen or coffee.
I was able to enjoy the Shilla Hotel Garden after eating at the Silla Hotel right in front of me.
The bus stop was close, so there was no inconvenience to use without rent."
282,10.0,There was a grass and the double bed bed was very pleasant.Satisfied with that alone.Small and comfortable hotel
283,10.0,"I made a reservation for my parents' birthday trip and accommodation, but the location was good and clean."
284,10.0,"I saw a review that breakfast is delicious, but I think the kind of food type and quality for the real price is so good.
If you have a chance to go next time, I think I'll choose because of breakfast ~ ^^"
285,9.6,"In Jungmun, I went to breakfast while only Shilla Hotel!Overseas feelings ~ The room service was all delicious, but the pizza was not so good."
286,10.0,"In fact, it's funny to be a 5 -star hotel, but it's so good and the best. I want to see the hotels around me."
287,10.0,It was so fun.The hot water pool is also excellent and the location and value for money are good.
288,10.0,"It was a good hotel for the family to stay.
The price was reasonable and the location was in Jungmun."
289,8.4,"Pool Villa was so good.
I think I'll use it again next time."
290,8.0,The location of the location was good.I like the bathroom.I want to visit again.
291,10.0,"I'm so satisfied
It was a cozy, kind and unfortunate day!I want to go again"
292,10.0,The accommodation was very clean and not complicated.I also liked the breakfast at night.
293,9.6,"I stayed in Jungmun with my parents and children, and it was really comfortable and enjoyable.However, the weather was so cold that I couldn't use the pool.The breakfast was satisfactory and the room hygiene was so clean and good.In particular, the children loved the bunker bed and were comfortable, so the couple+two children were satisfied!"
294,10.0,"The bedding is really warm and nice
After all, it was a 5 -star hotel 👍🏻
The view that I see when I open the window in the morning was wonderful
The location was also Jungmun, so it was okay to go here and there.
There was also a CU in front, so it was good to buy something.
The hot water pool didn't take a swimsuit and just watched it.
Even if you take a picture on the pool side, it's a photo zone.
It is pretty recommended 👍🏻👍🏻"
295,6.4,The kindness of the staff is felt from the front desk.I was welcoming with a bright smile .. I felt better with me.
296,10.0,"4 family
Family Bunk Room
This is the best accommodation in Jeju Island this week."
297,8.0,Not bad for the price
298,8.0,"I am comfortable with the cost of accommodation in the middle of 100,000 won.I like it because I have a staircase.
 In winter, I chose to enjoy outdoor water with warm hot water.

 Satisfaction"
299,8.0,great
300,10.0,"It's not far from the swimming pool, so you can move without much cold even though it was a winter trip.
Bunker beds and double beds were all comfortable
The terrace is not good to say, so the second round on the terrace ^^"
301,9.6,"It was a bad winter trip, but it was so good because there was a hot water pool.The staff are also kind and good!"
302,10.0,Clean facility friendly guide facilities are also satisfied with the comfort and pleasant trip.
303,10.0,"The location is next to Silla Lotte
It was good in the middle of Jungmun.

Thank you for the good service for the price for the price.
Especially the second floor bed is the best."
304,10.0,The staff were kind and the accommodation was clean!
305,7.2,"It's between a good hotel, so if you look at the hotel alone, it was just like that.
There is no merit compared to the price"
306,10.0,"Good price
Location good ..
Warm outdoor swimming pool good ..
Clean and comfortable rooms ..
I've been resting well."
307,10.0,I enjoy Jeju well with hot water pool.
308,10.0,"The children loved the double bed so much and for breakfast
The satisfaction was high.The pool hot water pool was also so fun.Even though it was cold, I couldn't feel the cold in the hot water pool.I want to use it next time."
309,10.0,"Bedding was good and breakfast was satisfactory ~
The location is also good, so I want to use it again next time !!"
310,10.0,It's a good value for swimming in the middle of winter.The facilities are clean and good.I want breakfast to be cheaper.
311,9.6,"In Jeju Island, there are many places that are already full, so I searched for the hotel.But 5 -star hotels were expensive and burdensome for 3 nights.I liked it because it was small but it was clean and had a swimming pool.The staff were also friendly!I think it's a place next time!"
