,score,comment
485,8.8,"Our couple living in Jeju Island sometimes stays in Jeju Hotels and stays in Jeju.Sweet Hotel Jeju Premier Sweet Room ~~ When check -in, the staff were very kind and the room was spacious and clean than expected. The bathroom had a bathtub and a shower booth and a large bathroom.For us who liked it, I couldn't sleep because it was a lot of honey, but the bedding was soft and clean.However, there was a lot of dust in the gap next to the refrigerator, which is not easy to reach.If you talk to the front just before 9 o'clock the day before, it helps to choose a breakfast at a discounted price next day.It was a pity that two pages of rudder and baked vegetables ate 60,000 won were a bit unfortunate ~~ And check -in event free drink coupons.I didn't receive it ~ In general, I liked the most was a large room."
486,6.0,"I used a lot before Corona
It is not good compared to the old days."
487,9.6,"The staff are also kind, clean and quiet"
488,10.0,The terrace room condition was the best and the atmosphere was good.
489,10.0,"It's a great accommodation located between Shilla Hotel and Lotte Hotel.
Sit on the terrace and enjoy breakfast room service.
This is recommended!"
490,8.0,"Everything was fine, such as location, but the facilities are a bit unfortunate."
491,8.4,"It's a location, so it's a Jungmun complex.
If you don't like to be fluffy in a hard bed, Goryeo is Goryeo ^. ^"
492,8.0,"The two -story bed and double beds were composed of a woman's net, and there was a terrace in front of you, so it was good to feel brunchy because it was a room service."
493,7.6,"I stayed for three people, but I was very comfortable."
494,8.8,"Good value for money and kindness
It is convenient because it is located in Jungmun"
495,10.0,Quiet and distant.I slept here.
496,8.0,You can also enjoy the water play and the room service breakfast is fantasy on the first floor.
497,10.0,It's a price -based hotel.The staff were also kind and breakfast was fine and so good
498,6.4,The toilet shower room facility
499,10.0,"There are a lot of terrace worms, but it's good to walk and bunker room good"
