score,comment
7.6,2월 7일부터 9일까지 4인가족 2박했어요. A동이었는데  전반적으로 객실 상태 양호하고  단열 좋습니다. 다만  방음은 약간부족요. 좀 오래된 객실스타일이 걸렸는데 비교적 가성비는 괜찮았어요. 부대시설은 애슐리퀸즈 괜찮았지만  나머지 시설은 좀 아쉬웠네요. 노래방만 있었어두..ㅜ 주차공간 적당하구  위치는 주변에 식당부족. 무조건 in house해결해야하는 조건 또는 아예 차가지고 좀 나가야 먹을만한데 찾을 수 있어요. 
4.8,부모님과 아이가 있어서 취사 가능하고 한실제공되는 룸을 선택했는데 청소가 거의 안되어있었어요 룸이 낡은건 감안했지만 곳곳에 먼지투성이고 바닥 구석은 더러웠어요 좀더 비용지불하고 리모델링된 룸으로 가는걸 추천합니다
7.2,"여름에 방문후 재방문 했는데 수영을 못하니 할만한 부대시설이 없어 아쉬웠어요
화장실에서 냄새가 났어요
"
9.2,전체적으로 시설이나 객실상태 맘에 들었지만 소음대처에 조금 안일하게 대처해서 아쉬웠어요 
10.0,너무 만족하고 갑니다
8.4,가족 여행으로 추천
7.6,"불편함 없이 가족들과 함께 잘 머무르고 왔습니다. 
전체적으로 잘 관리 되고 있다는 느낌인데 연식이 있어서 인지 숙소 내부는 리모델링이 필요하겠다는 생각이 들었습니다.
조식은 좋았습니다."
10.0,추천합니다
10.0,미취학아동 둘과 최고의 시간을 보냈습니다.
8.4,"비즈니스 출장 때문에 방문했습니다.
사우나 리뉴얼 중이고 헬스장이 없어서 아쉬웠지만 훔 컨디션이나 직원 태도  조용한 위치가 메리트 있었습니다. 향후 가족과 방문할 의향이 있습니다."
8.4,"리모델링을 하여 숙소가 깨끗합니다.
아이와 가기 좋은것 같습니다.
하지만 위치상으로 조금 애매합니다"
5.2,로비 및 복도는 리모델링으로 세련되고 좋은데 룸은 완전 구림
8.4,아이가 잠자리가 바뀌었는데도 잘 지내다 왔으며  숙소로 너무 잘 선택했음
8.8,"서귀포쪽 여행할때 좋습니다.
조용하고  부대시설도 좋습니다."
8.8,숙소 청결 상태  좋고 직윈들의 응대는  매우 친절하고 신속합니다.
10.0,"결항으로 하루 발이 묶여 선택했는데
이 전 숙소보다 너무 좋았습니다. 건물은 오래
되었지만 너무 깔금했고 유지가 잘 되었습니다. 특히 프런트 천정민님 너무 밝게 웃으시며 너무도 친절하게 응대해 주셔서 결항으로 짜증났는데 감사했습니다. 이것저것 물어보시며 편의를 제공해 주셔서 감동 받았습니다. 감사했습니다"
8.8,위치 좋고  한라산뷰 바다뷰 너무 멋진~~가격대비 최고입니다~다만 밤에 조금 추웠어요  외풍이  심합니다~중앙 난방이라  조금 춥더라고요
7.2,윗층 소음이 많이들림!
9.6,숙소에 머물면서 편안했어요.
9.2,엄마 모시고 갔는데 풍경도 좋고 거실있어서 너무 좋았습니다
9.2,"새로 리모델링 된 프리미엄 객실에
2박3일 숙박했는데 깨끗하고 너무 좋았어요"
10.0,"리노베이션 된곳이라 좋습니다
침구상태랑 깔끔하고 뷰도 좋아요
한라산 보이거나 바다뷰 둘다 어느곳이든 좋네요~~ 다음에 또 이용하고 싶네요"
7.2,가족 여행은 한 공간에 머물기 위해 리조트를 택했는데요  가격이 1박 대비 저렴하게 리조트에 묵을 수 있다는 장점이 있었어요. 하지만 그에 걸맞게 기본 서비스 정책이 모두 적혀있다고 해도 그대로 제공 받을 수 없다는 건 어느정도 감안하고 여행 가야하는 곳이예요. 2일차 청소 서비스를 받기 위해서 계속해서 다시 체크 하고 연락을 하고 또 해야했어요. 결국 다시 숙소 왔을 때 청소 되어 있지 않았고 마지막 날이라 체크아웃했는데  기본적으로 리조트 안에서 정책에 대해 젝원들이 잘 인지하지 못하고 있다는 느낌을 받았어요. 친절하시긴 했지만 리조트는 예약 시 안내 받는 손님마다 각기 다른 패키지나 서비스 등을 잘 인지하고 직원이 교대해도 그 메모가 잘 남아있고 체크되어야 하는데 그런 면이 아직은 아쉬웠어요. 하지만 1박에 16만원대였고 이런 서비스를 원하면 안되는거구나 하는 너그러운 마음으로 예쁜 바다뷰를 보고 싶고  난 청소도 내가 다 하고  크게 리조트에 바라는 게 없다 하시면 추천드려요~
10.0,서귀포 위주로 계획을 세우고 3박을 보냈는데 위치나 숙소의 청결  친절 아주 만족합니다.
10.0,아이들이 많아서 리뉴얼 되지않은 객실을 이용했지만 세월에 흔적말고는 깨끗이 관리 되어있어서 2박 머무는동안 아주 쾌적하게 잘 이용하였고 직원분들이 너무 친절하셔서 기분 좋은 여행을 했습니다
10.0,항상 성산쪽에만 숙소를 잡는데 이번엔 서귀포로 정해봤어요. 리뉴얼된 5층 객실에 3박 연박했구요. 창밖으로 보이는 풍경은 제주를 느끼기에 충분했답니다. 애슐리 뷔페도 만족스러웠고 케니 선물 행사에서 여러가지 구매했어요. 제품들이 시중가보다 저렴해서 기분좋게 동료들 선물구매했답니다^^~
9.2,조식포함으로 가격보고예약했지만 최종적으로는 일반예약이되어버려서   ..   아쉬웠음 
9.6,"부모님 모시고 간 제주여행. 켄싱턴리조트 서귀포 덕분에 더욱 행복했습니다.
멋진 일몰과 일출을 볼 수 있는 방으로 업그레이드 해주셔서 진심으로 감사했습니다.
리모델링 된 방은 아니었지만 관리가 잘 되어있어서 저는 다른 후기들과 다르게 특별히 불편함 못느꼈습니다.
이 가격에 이 인원이 투숙할 수 있다는 게 놀랍네요. 비수기라 그런 면도 있겠지만  이 위치에 이 가격이라면 저는 정말 최고라고 봅니다. 다시 제주도를 간다면 주저없이 이곳을 선택할 생각입니다.

한가지 아쉬운 점을 꼽자면 주차입니다.
면수는 많아서 문제 없는데 한 대 당 공간이 너무 좁아요..
차들이 다닥다닥 붙어서 주차가 좀 불편했습니다.
이외는 전부다 최고로 만족합니다.
"
10.0,방이 좀 너무 더워서 난방을 아예끄고 에어컨을 켜고 잤어요 그 외에는 위생상태나 위치도 좋았고요 리조트 뒤편 산책로도 있어서 좋았습니다. 직원분들도 친절하시고요 안에 있는 애슐리퀸즈도 맛있어요
6.8,"수건 갈아준다는데 기존 쓰던 수건 모아놓은 것도 안 가져가고 그냥 수건만 던져놓고 가고 청소상태도 만족스럽지 않습니다.
프론트는 응대는 친절한데 새벽에 대피알람 잘못 울린 것에 대한 설명도 너무 부족했고요. 아쉽네요."
10.0,아이들이 좋아함
6.0,방 온도를 찜질방으로 데워뒀는데 밤에 입실하게 돼서 환기시키고 에어컨 켜고 했는데도 열기가 안식어서 방에서  잠을 잘 수가 없었음. 거실에 작은 여닫이문 하나로만 환기가 가능함. 이틀 내내 침대에서 잠을 못자고 거실 소파 간이 소파에서 잠; 이 가격으로 다른 4 5성급 거실없는 룸들이 낫겠음.
10.0,일단 방이 너무 깔끔했고 바로 1층에 애슐리도 있어 편안하게 즐기다 갑니더~
8.4,"친정식구들과 8명이서 1박숙박했습니다.
1층에 에슐리퀸도 있어서 뷔페이용도 너무좋았고요^^아이가 한명 추가되었지만 친절히 이불세트를 내주시며 체크인해주셔서 너무감사했습니다^^깨끗하고좋아요 😀 "
9.2,가성비는 좋았으나 룸 가구 등이 매우 낡았어요. 예약 후 타사이트에서 더 저렴하고 혜택좋은 프로모션을 발견해서 아쉬웠습니다. 직원분들은 친절하셨고 조식도 마음에 들었어요. 산책로도 매우 좋았습니다.
8.0,시설 쾌적하고  서비스 좋았습니다. 특히  조식으로 애슐리 이용할수 있어 만족합니다.
8.8,숙소컨디션이나 청결상태 직원친절응대 등 서비스면에서 5점을 주고싶지만 룸이 많이 답답한편입니다. 거실빼곤 창문을 열수없고 트윈베드룸은 문이 안닫히게 짰더라고요    답답해서 잠을 잘 못잤습니다 ㅠㅠ
10.0,"리뉴얼된 객실 이용 했는데요 
중앙난방이라 개인적으로 객실 온도를 올리거나 내리거나 할 수 없었는데 조금 춥다고 하니까 온풍기 바로 가져다 주네요 서비스 좋습니다 객식도 깨끗하구요"
9.6,여름에 이용했는데 애들도 좋아하고 부대시설이 좋네요 ㅎㅎ
10.0,아주 추천합니다
9.2,"가격대비 좋은숙소~
연식이 있어 시설은 기대하지 마세요~"
10.0,"안녕하세요!
저혼자 어른 4분을 모시고가야되서 걱정도 되었지만 방2개에 작은거실에 진짜 멋진 오션뷰가 보이는 방이라 모두들 만족해 하셨어요!
겨울에 갔지만 리조트는  항상 따뜻했고 리조트는 야자수나무에 아기자기하게 잘 꾸며져 있어서 리조트안에서만 있어도 행복했어요!
가격도 저렴해서 더더욱 만족했답니다!😄
친절한 서비스 감사했어요!"
10.0,"24년 1월  겨울 제주도 여행을 계획후 숙소를 아고다에서 검색후 예약했습니다.

2박3일 비용도 적당한거 같고  각격만큼 숙박도 적당한거 같다는 생각이네요.

위치도 좋고  부대시설도 좋고 나름 만족했습니다."
8.0,"체크인하면서 20분 기다리고 
냉방 객실 줘서 객실 바꿔줌. 50분정도 허비함.
룸이 업그레이드 되어서 좀 다행.. 주변 산책길.경치는 좋음. 에슐리퀸 조식 좀만 저렴하면 좋겠음"
6.4,"급하게 일박했는데 가성비 좋고 
조식 맛있었어요"
9.2,방이 너무 깨끗하고 크고 창밖으로 보이는 야자수까지! 너무 좋았습니다. 그리고 방음도 잘되는지 굉장히 조용하였고 직원분들도 너무 친절해서 또 가고 싶어요 ㅎㅎ 가까이에 다정이네김밥집이 있어서 아침에 김밥과 떡볶이도 사먹고 켄싱턴간는길에 우연하게 아왜낭목재빵소라는곳을 알게되었는데.. 빵 미쳤습니다!!.. 호텔묵는동안 2번이나 갔어요 ㅎㅎ 다만 ㅠㅠ 호텔안에 놀거리들이 적다보니 조금 심심했지만 그래도 편의점이 있어서 아이스크림이랑 과자사서 가족들이랑 방에서 놀으니까 그정도 단점은 커버되었습니다 !
10.0,정원과 산책로가 대박.. 난방도 후끈대박.. 시설 및 직원 친절함도 좋음!
8.8,수영장 추가금액 과한것같아 불편했고  수영장 입.출구 직원들도 태도가 좋친안았어요. 그러나 그외 호텔컨디션 호텔직원. 모두만족
9.6,숙소의 가격대비 만족도가 높았습니다. 정원과 전망 주변 올레길이 좋았어요. 숙소 컨디션은 리모델링한 룸이 아니여서 조금 아쉬웠으나 가성비가 좋았고 주변에 맛집이 있어 편했어요
7.2,오래되긴 했지만 관리가 생각보다 잘되어있어서 있는 내내 좋았습니다
10.0,"다 좋아요 
라운지에서 기념품 할인해서 파는것도 좋고 주차장도 널널해서 좋네요."
7.6,조식부페  위치  직원들 태도 등은 5점 만점을 주고 싶어요. 하지만 방은 좀 낡은 느낌 입니다. 20년전의 가구  구조를 그대로 사용하는 듯.
10.0,직원분들은 최고 친절하시고  객실 상태도 너무 깔끔하고 좋습니다. 조식 또한 화려하지 않지만 아침식사로는 부담없이 즐길 수 있네요~^^ 현재 사우나는 리뉴얼중이라 아쉽지만 앞으로는 좋을 것 같고요  가족여행이시면 시끄럽지 않고 좋은 가격으로 지낼 수 있을 것 같네요~^^
7.6,굳
9.6,체크인할 때부터 친절함을 느꼈는데 체크아웃할 때도 역시 친절함으로 기분좋게 마무리 해주는 곳이네요. 재방문의사 100프로 입니다!
10.0,직원분들이 친절합니다.
9.6,가성비 최고. 정말 만족. 물론 오래된 시설이지만 직원들의 친절함이 그 불편함들을 상쇄하네오
10.0,"주변 산책길  경관도 정말 좋았습니다.
내부시설도 깨끗하고 숙소도 만족스러웠습니다."
10.0,"비행기타고 다음날부터 아이가 갑자기 열나고 감기몸살걸려 카페에서 쉬다가
너무 안되겠어서 조금 이르게 들어간다했을때도
김동희 여직원분이 아이걱정해주시고 업그레이드해주신 덕에 
3일차부터는 컨디션 회복해서 성산쪽에 10만원정도 예약한 4일차 다른곳 숙소 예약 환불이 안돼두
그냥 켄싱턴 연박하기루했어요!!
조식포함 40조금 넘는가격에 엄마모시고
효도관광했네요
담번에도 이용하겠습니다
오션뷰 멋지고 방컨디션도 깨끗했어요

"
6.0,"너~무 추운 숙소!!!
하필 눈이 오는 추운날 숙소를 찾았었는데...
아이가 있어서 일부러 온돌을 예약했음에도...온돌은 온돌의 기능을 하지못하여...밤새 너무
추웠습니다...
방을 어떻게 따뜻하게 할 수 없는지 문의했으나중앙난방이라...어쩔수 없다는 답변만...
진짜 어디 놀러가서.. 리조트가 추운방은 없었는데...새벽에 절로 욕이 나오더군요...
그러나 직원분들은 친절하셨어요..."
9.6,가족들이 결항으로 오지 못하고 저만 제주에 혼자 남게 됐는데 숙소 주변에 올레7길이 있어서 혼자 여행하기도 좋았고 무엇보다 혼자도 이용할 수 있는 흑돼지BBQ식당(무제한 생맥주...직원분들 몹시 친절)도 나무 좋았고 오션뷰로 보는 밤섬이 절경이에여! 마운틴뷰여도 산책길로 가면 얼마든지 일출도 일몰도 볼 수 있어 최고구요 ㅜ 결항으로 혼자 된 저를 배려해주시고 친절히 편의 봐주신 모든 친절한 직운분들 덕에 혼자서나마 넘넘 힐링했습니다 ㅜㅜ 감사해요!!켄싱턴 리조트 서귀포 짱 또 올게요
10.0,리모델링 방으로 추천해여!
7.6,참 좋았어요
6.8,"3대가 같이 숙박하기에는 좋아요
다만 조식 사우나 수영장 등 부대비용이 추가요금인게 아쉽네요"
8.0,줄겁고 행복한 시간 보내고 갑니다. 가족여행. 추천드려요
9.6,"가성비 좋은 제주 리조트로 추천해요. 산책로도 정말 멋지고  기본적인 것이 잘 갖추어져 있어요. 여름철에는 늘 수영장을 잘 이용하는데. 눈 내리는 설경도 참 예쁘고 좋았어요.
맛있는 애슐리퀸즈 조식을 먹을 수 있어 더 좋아요.*^^*"
9.2,가성비는 좋았어요. 겨울이고 많이 추웠는데 난방이 밤9시반부터 됐고 (10시에 틀어주는데 춥다는 클레임이 있어서 30분 땡겨짐) 거실 창가쪽은 웃풍 너무 심하고..안방 창가도 심한편이였어요. 그점만 빼면 가성비 좋네요
10.0,가족6명이서 사용했어요 리모델링된 방으로 배정해주셔서 깔끔하고 깨끗한 방에서 지낼 수 있었어요 화장실이 작은 감이 있지만 대체적으로 만족합니다 특히 체크인 도와주셨던 분이 정말 친절했습니다
8.0,날은 춥지 않았는데 비 와서 숙소에서 연박 내내 저녁까지 요리 포장 해먹었네요 리모델링 안된 객실 이용했는데 오래되긴 했더라구요 안방은 넓긴 한데 창문이 열리지 않게 한 구조라서 답답한 면이 있었지만 침대는 정말 편하더라구요 거실은 크진 않지만 식탁의자 쇼파 잘 이용했구요 주방이랑 냉장고 야무지게 이용했어요 욕실은 오래 되긴 했어도 수압도 쎄고 뜨거운물 잘 나와요 욕조 있어서 아이들 씻기기 좋더라구요 연박 시 청소 해주시지 않는데 쓰레받이랑 빗자루 따로 있었어요 건조대도 아이 빨래 간단히 하고 잘 이용했네요 오션뷰인데 바다와 바로 앞 계곡뷰 시원하고 이색적이었고 조식은 하루만 이용했는데 에슐리가 크진 않아서 가격대비는 살짝 아쉽지만 기본적인 건 다 있어서 잘 이용했네요 키즈몽까페는 너무 작고 책만 몇개 있어서 7살 아이는 시시해 하더라구요 부대시설이 살짝 아쉽지만 리모델링 전 객실은 가성비고 리모델링 후 객실 이용해볼만 할 거 같아요 
10.0,"부모님이랑 저 3명이 이용했는데 방 구분되어있는점이 좋았고요
아빠가 방에서 한라산 보이는 것도 좋아하셨어요!
거실공간 있는 것도 좋았습니당
조식부페가 애슐리퀸즈라 음식 종류 많은것도 좋았습니다.
시간이 안맞아서 사우나 이용못한건 좀 아쉬웠습니다ㅠ.ㅠ

방 상태 위생 나쁘지않았어요 침대에 살짝 얼룩같은게 있긴했지만 신경쓰일정도는 아니었습니다.

프론트에서 응대해주시는 직원분들 너무 친절하셨어요.
만족스러운 숙박이었습니다 ~~
"
9.6,가족과 힐링하기 좋아요 
10.0,"서귀포 관광지들과 가깝고  주차하기 편하며
무엇보다 숙소가 너무 깔끔하고 좋았다
숙소에서만 놀고싶다는 생각이들정도로 좋았다
가족단위 여행객들에게 매우 추천하며 재방문의사100%다"
10.0,"3박4일중 2일차에 묵었던숙소
가성비도 깔끔함도 여기가 최고였어요
다음에 신랑이 켄싱턴서귀포로만 다잡으라네요
리뉴얼해서 엄청깔끔하고좋았어요~!"
10.0,전망과 시설이 우수하고 좋습니다.
8.0,"일단 리모델링 한 룸이 아니라서 룸컨디션은 별로예요.
화장실 구조도 불편하고 성인4명+아이2명은 방이 좀 작긴 해요 4인가족은 괜찮을듯요.
직원분들 너무 친절하시고 산책길이나 정원도 멋지고 로비도 잘 꾸며 놓으시고 다 만족해요"
9.2,몇년전에 가고 좋아서 이번엔 2박으로 오션뷰로 갔습니다ㆍ평수도 크고 전망좋고 산책하기도 굿입니다 ㆍ다만 오래된건물이라 ㅡ 발코니쪽이 위생상태 안좋습니다 곰팡이인지 뭔진 모르겠지만  ㆍㆍ ㅠ
10.0,깨끗하고 경치도 좋았어요
10.0,very convenient  clean  nice food  and kind staff. 
10.0,편하고 께끗하고 주변 관광지 접근성이 매우 좋습니다. 
8.0,서귀포에서는 이중섭거리 주변에 주로 머물러서 위치는 좀 서쪽이었지만 가격대비 좋았습니다. 여름에 한 번 더 와야겠다 생각했어요. 조식은 양식은 치즈도 없고 요거트에 얹어먹을 건과일이나 견과류도 없이 많이 부실한 느낌이나 한식 좋아하시는 분들에겐 추천합니다.
10.0,룸 업그레이드도 해주시고  동생들이랑 편하게  숙박하고 왔네요 
10.0,얘슐리도 있어서 밥먹기도 편했구 좋았어요
10.0,"여자4명이 급번개로 제주도가기로결정! 비행기표구하고  숙소정하게 되었는데 2년전에 묵었던 켄싱턴기억이 나쁘지않아  또ㅇ켄싱턴을  예약하게되었다. 직원들정말 친절하고 조식도 애슐리뷔페라 깔끔하고 맛도좋았고 롬컨디션이 리모델링해서 2년전보다 훨씬좋아졌고
미니바서비스로 맥주2캔과 컵라면도 너무잘먹었다.
예약을 담당했던 나는 친구들한테
좋은가격에 숙소 잘잡았다소리 들었고
이제는 제주가게되면
무조건 켄싱터니조트로 예약할것같 다!"
8.8,"근처에 간단하게 한잔할 수 있는 술집은 없지만 리조트 자체는 매우추천합니다.
최근에 리모델링해서 깔끔해요"
10.0,조식 좋아요. 직원분들 참 친절하고 상냥합니다. 주차 편해요. 편히 쉴 수 있는 곳입니다. 
5.6,주차장 너무 좁고 주변 편의시설없음. 청소바닥에 머리카락그대로이고 정리만 해놓고가는듯. 대박어이없는게 수영장임ㅋ일찍문닫고 이용시간 달라도 금액이 똑같이받음.썬베드 결제안하면 앉아놀곳도없음. 
8.0,항상이용하고있어서 서귀포가면 캔싱으로 고우!! 아들이 무척좋아해서 만족한여행이되었어요 공기가 건조함 빼곤 깔끔하고 조용함  조식이 업해줘서 식사했는데 잘나오는편이예요.
10.0,새로 리뉴얼된 숙소에서 지냈는데 너무예쁜 숙소였습니다. 정원도 예쁘고 바다도 보이고 저녁으로 에슐리퀸즈 에서 먹었는데 가성비 갑입니다. 
10.0,좋아요 직원분들도 친절하시고 모든 것이 좋았습니다
10.0,조용하고 직원들이 전부 친절이 몸에 뵈여서 좋았습니다
10.0,룸도 뷰도 너무 좋고 직원분들도 친절하셨어요
6.0,가격대비 방 컨디션은 좋았지만 위치나 부대시설이 좀 부족한거 같아요
9.6,직원분들도 너무 친절하셨고 룸상태도 너무 좋았습니다 산책하기도 너무 좋았고 맥주와 컵라면도 너무 맛있었습니다
10.0,둘째날 숙소로 서귀포쪽으로 정했는데 좋아요 실내도 깔끔하고 넓고 트윈하고 싱글 베드가 방이 나눠져있어서 더 좋은듯하네요 잘 묵다 갑니디
10.0,켄싱턴 리조트 리노베이션 룸에서 하루 숙박했습니다. 룸 컨디션도 좋고 직원분들도 너무 친절하셨어요. 웰컴 푸드(컵라면이랑 맥주)도 있어서 너무 기분좋았고 방안에 전자레인지가 있어서 음식을 데워먹을수 있어요! 그리고 야외 조경도 예쁘게 잘 되어있어서 산책하기도 좋았습니다. 가족단위 여행객들이 많던데 그 이유를 알수 있었습니다.
9.6,조용하고  전망도 좋고 가족동반 힐링하기 딱 좋은  숙소예요
10.0,숙소가 깔끔하고 예뻐서 머무는 내내 힐링이었어요 부모님도 좋아하시고 아이도 꿀잠자는 편안한 숙소였네요 매일보는 한라산뷰까지 너무 멋있었어요! 강추합니다 서귀포라 다니기에도 좋았어요 편의점도 크고 제품도 다양햇어요!
10.0,지난 제주여행때 애슐리 이용하기 위해 잠시 들렀다가 조경 등 리조트 전체 분위기가 너무 좋아서 이번 여행때 머물게 되었습니다. 1박만 예약 했다가 1박 더 추가 했습니다. 체크인시 직원분이 정말 친절하게 응대해 주시며 룸 업그레이드까지 해 주셔서 편안하고 기분좋게 머물수 있어서 감사하다는 말 남깁니다. 다음 제주 여행때도 머물고 싶습니다.
9.2,"일단 직원친전도가 만점입니다
리모델링한 객실에 묵었는데 깔끔하고 쾌적했으나 약간의 불편이 있었어요. 방충망이 잘 안닫히는? 지하에 있는 마사지샵도 솜씨 좋아서 
스포츠마사지 받고 꿀잠 잤습니다ㅋ 

산책로 잘되어있고 뷰가 아주 근사합니다. 주변 식당  관광지도 10키로 이내 갈곳 많아 좋구요. "
10.0,"켄싱턴 호텔의 시설도 너무 좋았지만 
무엇보다 하태형 직원분의 친절함 덕분에 호텔의 만족도가 10배는 좋았던거같습니다
덕분에 다음날 여행도 기분좋게 했던것 같습니다
감사합니다"
10.0,"숙소 오션뷰 신청했는데 너무 예뻤고 리조트 자체가 관리가 잘 되어있어요
조식은 애슐리 퀸즈라고 기대했는데 너무 기대치만 높게 가시지 않으면 만족하실 수 있습니다!
즐거운 여행으로 마무리했습니다"
6.0,위치와 조경  직원친절도  내부시설 모두 좋습니다
7.6,"위생  직원  가격은 매우 좋았지만 오래된 시설이 매우 아쉬웠음.
화장실은 하나밖에 없고  매우 작아서 가족단위 여행은 힘들수 있음."
4.4,"여태 한국여행 숙소 중
최악...
중앙난방이어서 넘춥고
진짜 오래된숙소여서 넘실망했어요
두번은 안올곳 ㅜㅜ "
10.0,"오래되었지만 깨끗함
직원이 친절함
주차장 넓음
조식부페가 애슐리인데 음식도 괜찮았음

난방이 잘안되서 추웠음. 얘기하니 히터. 제공하여 해결되었고 처리속도도 매우 빨랐음

종합적으로 추천합니다"
10.0,제주도를 몇번 오면서 많은 숙소를 가봤지만 위생상태나 서비스등이 정말 너무 만족이상이였고 제가 간 날에는 숙소가 남아있어 방을 업그레이드까지해서 주셨는데 프리미엄 오션뷰 방이 너무 좋아서 다음번에도 기회가 된다면 또 가고싶은 숙소 1위인것 같아요
9.2,"위치가 좋고 부대시설이 많아 편리했습니다 
체크인 카운터 앞에서 파는 기념품들의 가격이 저렴하고 상품이 다양해서 좋았습니다 아이들이랑 주변 산책하고 부대시설 이용할게 많았어요 
저희는 겨울이라 수용장을 이용하지 못해 아쉬웠네요 여름에 다시 한번 방문하고 싶습니다 
침구의 위생은 아쉬웠어요 커버가 더러워서 투숙하는동안 조금 찝찝했지만 연락 드리지 않았습니다 개선 부탁드립니다 "
10.0,가족 여행으로 묵었는데 직원분들 정말 친절하시고 알아서 리모델링 룸으로 업그레이드도 해주셨어요. 룸에 웰컴푸드도 감사했구요. 조식 포함 예약했는데 구성도 좋고 맛도 있고 앞으로도 제주 갈 때마다 묵을 것 같아요~
