score,comment
10.0,"매달 4일가량 제주를 방문하는데 주로 호텔에서만 지내다 이번엔 오랜만에 가족들과의 여행이라 이곳에 재방문했습니다.  여러번 이용했었지만 이전 풍림일때도 자주 찾았던 리조트입니다. 
이 리조트의 큰 장점이 위치인거같아요. 서귀포 가운데 위치해 있어서 제주도 이곳저곳 다니기에 아주 좋은 위치인거같아요. 이마트도 가까이 있어서 완전 좋더라구요. 리조트 주변이 시끄럽지않고 산책하기도 좋습니다. 
체크인시 예약했던 룸과 좀 달라 문의했더니 다시 룸변경해주셔서 다행이었구요. 깔끔하게 부분 리모델링이 된듯해서 쾌적하게 가족들과 2박을 즐기다가 왔습니다. 침구류도 좋았습니다.
단점이라면 tv가 거실에없고 방에 있는게 가족들이 살짝 불편했지만 여행와서 tv는 보지말자구하고 ㅋㅋ그리고 애슐리 디너예약후 방문했는데 수학여행단이 너무많아 거의 먹지못하고 도망나오듯한게 좀 불편했어요. 수학여행단은 따로 식사했으면 좋을거같아요.
오랜만의 가족여행에 내집같은 편한함을 느끼며 좋은 추억이 되는데 큰 역할을 해준 켄싱턴리조트.
큰형의 건강이 더 나빠지질 않길바라며 또다시 어머니와 큰형을 모시고 방문할수 있기를 빌어봅니다.
"
10.0,"1박으로 성인4  유아2 숙박했고 제가 특가로 예약했는데 운좋게 리뉴얼된룸에묵었습니다.
이 가격에 지금까지 가족여행 다녔던 호텔 리조트 중에서 시설이나 룸크기 컨디션이  제일 좋았던 것 같습니다.
 가구도 모두 새거라 깨끗하고 인테리어도 딱 적당히 고급스럽고 쾌적하고 편안해서 좋았습니다. 
가든뷰도 예쁘지만  방안에서 마운틴뷰 너무 멋있었구요.
60대 부모님 모두 만족하셔서 다른데안가고 숙소에서 더계속 더 머물자고 하셨네요. 어린이들데리고 이곳저곳 차로 이동하기 힘든데 리조트내 가든이 예쁘고 거기서보이는 바다뷰랑 올레길이있어서 빨리 체크인하고숙소 머물면서 쉬었으면 오히려 더 좋았을걸 싶었어요. 
숙소에서는 한라산뷰  정원에서는 바디뷰가 있던 점이 암튼 최고로 좋았구요.
그리고 직원분들이 정말 친절하시네요 투숙객들 얼굴을 기억하고 계신건지 하나하나 살뜰히 필요한 점을 챙겨주셔서 저희가족 모두 잘 접대(?)받는 느낌이었습니다. 좋은 호텔도 그렇게 일일이 챙겨주시지는 않던데  참 서비스 하나하나 세심하시더라구요. 
시살 곳곳 돌아다니시던 정장입은 남자직원분  데스크에 여자 직원분 조은설매니저님 덕분에 가족들과 편안히 머물렀어요 진심어린 서비스에 감사합니다"
10.0,"서귀포 켄싱턴 리조트 앞에는 버스정류장과 공항버스정류장이 있답니다^^!
차 없이 돌아다니기 편해요.
리조트의 바다 경치와 편의점.  세탁실. 직원들의 친절함은!!브라보~~ 짝짝짝!
왠만한 서귀포 관광지는 다양한 버스들이  다녀줘서 이동 편하고 제주도민들과 얘기도 할 수 있어 정보공유가 가능했어요!
주의할 점은 버스를 타기 위해선 버스가 다가 올 때 적극적으로 손을 흔들어 의사 표현해 주시고^^~(버스가그냥 지나갑니다) 버스 안에선 기사님들이 다양한 나라의 관광객에게 지쳐 계시기 때문에 떠들면 안돼요!! 쉿 조용!! 교통체계가 육지와 다르니 색다름을 느껴 보길 바라며~아고다 고맙습니다! 생각보다 너무 좋아 일행들에게 고맙단 인사 들었습니다^◇^ 걷는거 좋아하시는 분들 강~~추!

"
10.0,"4박5일 정말 즐겁고 편안한 시간 보내고 갑니다🙂

라운지와 룸  유아도서가 비치된 코코몽 라운지  애슐리 퀸즈 조식  24시간 편의점  오락실 모두 알차게 이용했어요.

체크인 할 때 룸도 침대방+침대방  침대방+온돌방 등 여러구조를 친절하게 알려주시고  거실에서 자는 아이들을 위해 침구도 제공해주셨습니다.

저는 프리미어 플러스/마운틴뷰였는데  깨끗하고 깔끔한 시설과 제주도에서만 볼 수 있는 야자수와 한라산 뷰 모두 마음에 들었어요. 커피머신  전자레인지  커피포트 비치되어있고 건식 세면대라 온가족이 쓰기 편했어요. 수건도 넉넉하고 매일 아침 신발장 앞에 놓으면 교환해주셨습니다.

리조트는 남쪽에 위치해 있어 저는 하루 동쪽  하루 서쪽  하루 남쪽 이렇게 투어하며 일정짜기 좋았어요.
여행 온 가족들 가격과 시설에 모두 만족해했어요.🙂
다음에 제주도를 오게 되면 재방문 의사 있습니다👍"
10.0," 직원분들이 모두 진심으로 친절하신걸 보니 친절하신 김민규지점장님이 모범을 잘 보여주셔서 그런가 싶어요. 
 리뉴얼된 룸은 인테리어도 훌륭하고 침대 매트리스와 침구도 좋아서 2일 동안 여독을 충분히 풀고 꿀잠을 잘 수 있었습니다. 전자렌지  캡슐커피머신  수저 컵  와인잔 접시  전기포트 등이 깔끔하게 정리되어 있었습니다.
 제주에일과 생수 제주컵라면등도 기본으로 1번  제공되었는데 모두 맛있었어요.^^
풀장에는 안전요원도 4 5명이나 상주하고 세세히 살피고 있어서 어린아이들과 놀기에도 좋았습니다.
리조트는 편의점부터 안의 시설물까지 일회용품 사용을 지양하고 있어서 제주환경을 지키는 실천을 하고 있었어요.
비오는 날에는 리조트 주변만 돌아도 충분히 살책을 할 수 있었고 리조트 주변의 제주곰집이라는 맛집은 걸어서도 갈만한 거리이고 그 외 배달가능한 맛집도 많았어요.
가족단위 여행이라면 켄싱턴리조트 서귀포 완전 강추입니다."
10.0,"부모님모시고 켄싱턴리조트 리뉴얼 룸 3박 이용했습니다! 마지막날 다른 가족이 추가입실하게되어 최대수용인원 침구추가가능여부와 금액  연박청소서비스를 받을수있는지 등 여러가지 질문이 많았는데 천정민담당자님이 아주 친절하게 설명  안내 및 추가@서비스까지 제공해주셔서 체크인시부터 기분좋은 여행이 되었습니다^^
외관은 오래되어 연식이 느껴졌지만 관리가 잘되어서 깔끔하다는 인상을 주었고 룸은 말할것도없이 리뉴얼되서 사진과 똑같습니다 ㅎㅎ들어가자마자 웰컴간식과 라면 맥주가 있더라구요 알차게 구성되어있어 잘 먹었어요~ 또한 베개에서 안좋은냄새가 나서 프론트에 교체요청드렸더니 바로 조치해주시더라구요 빠른처리로 불편함이 없엇습니다!
로비도 아주 깨끗하고 정원이 진짜 잘 가꿔져있어요 부모님이 매일 아침 산책하시면서 즐거워하셨어요! 
위치도 중문쪽이라 관광하기 좋구요 주변에 음식점이 많지는 않지만 리조트 입구에 삼겹살집 중국집도 있고 리조트내에 애슐리도 잇어서 식사걱정없이 지낼수있겠더라구요ㅎㅎ
저는 연휴에 이용하게 되어 저렴히 이용한것같지는 않지만 여러모로 만족도가 높아서 다음 제주여행때에도 재방문하려구요~ 잘 쉬고 편히 여행했습니다 아! 다시한번 천정민담당자님 감사해요!"
10.0,"급하게 잡은 숙소라서 아이들데리고 잠만 자야지 했는데 서귀포 제일 경치 좋은곳에 있는것 같아요 일출도 객실안 침대에서 볼수 있어 더없이 좋은 여행이였습니다. 
아이들 데리고 항상 숙소 청결상태는 늘 신경쓰는부분인데 만족 200프로 입니다! 
오래된 객실이라고 하는데 전혀 느끼지못할만큼 깨끗하게 잘 관리되어있더라구요! 
조식은 애슐리라 말할것도 없도 경치 끝내줍니다^^
(꼭 신청해서 드세요!)
사우나는 제가 갈땐 가오픈 기간이라 사람이 많지않았는데 드라이기도 새제품이라 좋았구요 빗도 다 개별 포장해서 소독기로 돌려주시니 넘 좋더라구요^^
다음번 여행에도 무조건 서귀포점으로 갑니다! 
아참 로비 한켠에 제주도 특산물파는 코너가 있는데요 
올레시장 가지마시고 여기서 꼭 사세요
(시장보다 저렴해요 시장은 구경만 하는걸로^^)

"
10.0,"수영장있고 가족 숙박 시설위주로  찾아 봤었는데 진흙속의 진주를 찾은 듯한 기분이었어요.
생각보다 시설도 깔끔했고 직원도 친절했고
비록 바다뷰는 아니었지만 5식구 큰방으로 업그레이드 해줘 여행시작부터 기분을 좋게 해주었답니다. 지하에 애슐리 퀸이있어 돈을 내고 조식을 먹었답니다.  종류는 적었지만 맛있었어요.  수영장높이도  1.5/1.2/1.0 깊이로 나눠져 있어 좋았고 안전요원들이 많아서 안심하고  물놀이 했답니다.  수영장 스낵바에 파는 종류도 여러가지이고 비싼 호텔보단 애들 데리고 다녀 오기엔 최적화였답니다. 이젠 제주도 오면 여기로 정착 할 정도로 다음에도 또 이용할 계획이랍니다. 추천함!!!"
10.0,"나이들어 조금씩 자유롭다는 것은 내주변에 많은 도움과 배려를 받고 있다는 증거이다.
늘 맘에  머물고 싶었던 그곳 서귀포  켄싱턴은 친구들과 올레길 걷다가 알게된 보물 같은 곳이다.
제주도 올때 가끔 지인찬스로 머물기도 했던 서귀포 켄싱턴리조트 ~
드뎌 7일을 친구와 함께 하기로 한 날
너무 기뻤다~
제주도는 숙소가 너무 많지만 내친구가 처음 뱅기 타고 처음 가는 제주도 인지라 제주를 느끼고 다리가 아파서 잘 걷지 못해도 숙소 주변산책이 가능하며 때때로 음식도 주변에서 해결해야 했던 나에겐 가성비 갑이었다.
조금걸어서 도로 타고 내려가면 다정이네 김밥 그 건너 앞에 카페에서 샌드의치와 커피한잔 .가격도 착해  맛도 좋아 ! 중년의 우리에게 안성맞춤이랄까~ㅎ
그리고 켄싱턴에서  애슐리의  식사는 내 마음에 쉼터를 찾은듯 편안했다.
미처 개인사정으로 일정을 다 못 마치고 올때 가족처럼 대해주던 프론트의 친절은 내맘을 흔들었고 하은년 님의 깊은 배려는 잊지 못할 추억으로 고이 간직하고 싶다. ""혹시~ 제가 도와 드릴게  있으면  말씀해주세요 도와드리고 싶습니다""라는 고마운 마음은  나도 살아가면서  누군가에 자연스럽게 나올 수있어야겠다는 마음을 먹게 하였다
리모델링 중이어서 군데군데 어수선함도 일정을 진행하느라  그다지 불편하지 않았다 .고객에게 더 많이 가까이 가고 있는 서귀포켄싱턴리조트 발전을 기대해본다
감사해요   서귀포켄싱턴리조트 ~^^"
10.0,"리뉴얼된룸을 3박 사용하였습니다
쾌적한 룸컨디션과 오션뷰 좋았습니다
부모님이 다리가 안 좋으셔서 올레길 대신 리조트내 산책코스를 아침저녁 즐기셨답니다
애슐리 조식도 체크인시 결재하면서 20% 할인 받을수있어 좋았습니다
친절한 직원분들도 감사했습니다"
10.0,친정 부모님 모시고 갔습니다. 친정 부모님은 항상 여행 시 펜션 위주의 숙박을 즐기시는 편인데 이번 제주 여행은 제가 아이도 있고 해서 켄싱턴 서귀포로 숙소를 잡았는데 탁월한 선택이었어요. 첫째 깔끔하구요  호텔급은 아니지만 서비스 만족도도 좋았습니다. 그리고 아침저녁으로 부모님이 리조트주위를 산책하셨는데 너무 좋았다 하시네요.  다만 켄싱턴이 아이동반해서 가는 경우가 많으실텐데 리뉴얼된방에도 온돌룸이 있었으면 좋겠다 하는 작은 바램 하나가 있네요.  직원분들도 굉장히 친절해요. 내년 여름에 수영장 오픈기간에 재방문할 예정이에요.
10.0,제주여행 시 켄싱턴 리조트 서귀포점 추천합니다. 가격도 적당하며  특히 직원들이 엄청 친절해서 기분좋았습니다. 객실도 리뉴얼한곳에 머물렀는데 깨끗하고 방2개  거실 다 만족스럽습니다. 가족들이 편한하게 왔다갑니다. 전체적으로 숙소가 만족스러워서 다음에도 재방문할거같습니다! 
10.0,처음에 숙소 문 열면 잠시 놀랄 수 있지만 ㅎㅎ사용하는 데에는 부족함이 없었습니다. 다회용기에 담겨있는 샴푸 등이 오히려 부족할까봐 불안한 어매니티들보다 좋았어요. 수건도 매일 넉넉하게 주시고..위치도 너무 붐비는 곳에서 살짝 비껴나있어서 조용하고 좋았습니다.
10.0,지은지 좀 지난 숙소라 별 기대 없었는데 요새 지은 호텔들 보다 더 깨끗한 것은 물론이고 리모델링으로 세련된 분위기에 가족 모두 기분전환 제대로 였어요! 게다가 제일 인상 깊었던 것은 지나는 직원들마다 표정이 밝아 응대에 대만족이었는데 특히 “하태영” 이라는직원분께서 제주에 대해 잘 모르는 우리 가족에게 주변 맛집이며 놀거리등 귀찮을법한 질문까지 친절히 알려주셨는데 손님을 끝까지 도우려는 서비스가 최고였어요! 그 분 덕에 캔싱턴리조트의 좋은 이미지를 잘 느끼고 갑니다! ^^
10.0,"이번 제주 여행일정 중 단연컨대 가장 좋은 숙소였습니다.
5살 아이와의 여행에 아이가 너무 좋아했네요.
우선 아이가 어려서 엄마와 함께 자야하는데 마스터룸에 있는 침대가 충분히 컸습니다. 소파가 침대 바로 옆에 있고 소파에 앉아서 아이가 바깥 뷰를 보는걸 제일 좋아했어요.
작은 방에 있는 싱글 침대도 작지 않아서 좋았고 침구류 관리상태도 너무 잘 되있어서 우리가족 편하게 잠들 수 있었습니다.
거실과 주방에 있는 집기류  소파 전부 깨끗하게 정비 되어있고 직원분들도 친절하게 응대해줘서 너무 편하게 있었습니다.
다음 가족여행때 다시 서귀포를 방문하게 된다면 고민없이 켄싱턴 서귀포 점을 이용할 것 같네요.
덕분에 편안한 여행이 되었습니다."
10.0,위치도 여행 목적지와 가까워 좋았고  2시쯤 계시던 단발머리 여직원분께서 친절히 응대해주셔서 너무 감사했습니다 덕분에  가족여행에 좋은 추억이되었습니다.  조식도 맛있어요  정원도 산책하기 좋았습니다 추천해요! 그리고 감사합니다 : )
10.0,"직원분들도 정말 친절하시고 
시설도 아주 넓고 깨끗하고 깔끔하고 쾌적했습니다 제주도 오게되면 꼭 다시 들르고 싶어요
조식도 너무 훌륭하고 경치도 너무 좋고 덕분에 정말 가성비 만점에 좋은 서비스 받고 갑니다
신혼여행지로 추천해요"
10.0,"리조트 직원들의 친절한 태도에 만족스러운 가족여행이 되었습니다
자식 및 부모님 여행의 특성이 있어서 예정된 상황과 다른 일정이 많이 발생하게 되어서 직원들 한테 어쩔수 없이 무리한 부탁도 많이하고 예약된 상황도 취소하게되는 상황이 많았는데고 친절하게 대응하고 처리해 주셔서  정말 고맙게 여행을 잘 마무리하게 되었습니다. 다음에도 제주도 여행가게 되면 킹스턴리조트 꼭 다시 갈것 같습니다(ps 불만 많은 아내가 만족하는 리조트  ㅎㅎㅎ)"
10.0,"저렴한 숙소 찾아 간거라 기대 안했는데
방도 리모델링된 방으로 업그레이드 해주시고
리조트 내부 정원도 너무 멋있고 산책하기 좋았고
시설도 다 깨끗하고 로비 분위기도 좋고 수건도 완전 새거라서 좋았고 침구도 깨끗깨끗!
2박하는 동안 너무 만족스러웠어요
특히 천정민 직원의 친절서비스에 놀랐네요~
덕분에 기분 좋은 여행이었어요~"
10.0,5인가족이라서 신라호텔 예약하기에 부담이라 저렴하게 일박하자는 생각으로 예약했는데. 완전 리틀 신라호텔입니다. 조경이랑 산책코스도 잘되어있어서 리조트 분위기 살구요. 리모델링된 룸이라서 넘 깨끗하고 쾌적하고 편하게 잘이용했습니다. 직원분들도 친절하고 상냥해서 체크인아웃시 기분이 좋았습니다. 담에 제주여행을 간다면 주저없이 켄싱턴을 또 선택할거 같아요!!
10.0,"어머니랑 외할머니 모시고 다녀왔어요!

주변 산책로가 정말 너무 예뻐서 산책로를 너무너무 좋아하셨고  조식도 너무 만족스러웠습니다. 방도 리모델링객실이라 깔끔하고 쾌적했어요~~ 체크인할 때 직원분도 너무 친절하고 최대한 편의를 봐주려고 해주셔서 감사했습니다. 다음에 또 가족여행을 온다면 여기로 올 것 같아요~~

그리고 주차장도 자리여유많아서 좋았어요♡"
10.0,주변 산책로도 너무 이쁘고 리모델링 새로 해서 가격대비 컨디션 가격 서비스 모두 좋습니다. 직원분들 서비스도 너무 친절하셔서 가족들 모시고 간 여행 너무 만족 스러웠습니다.
10.0,"어른들 모시고 가면 혹여나 지저분하진않을까 걱정이었는데 너무 깨끗해서 좋았습니다. 특히 리뉴얼된 곳이라 그런지 침대  소파는 편하고 에어컨도 새거라 청결면에서 이용하기에 찜찜하지않았습니다. 
커피머신  무료음식도 만족이요.
또 하나 욕실욤품도 넉넉하게 대용량으로 준비되어 부담없이 사용할 수 있었고 수건과 깨끗한 침구류를 제공해주셔서 서비스에 완전 만족한여행이었습니다.
주차도 편리하고  주변 올레길도 산책하기 좋고 편의점  카페 등 필요한 시설이 멀지않고 복잡하지않아서 다음에도 서귀포 켄싱턴으로 또 오려고합니다. 
이제껏 제주 여행 중 숙소는 최고요~~~^^"
10.0,숙소 리모델링하셔서 상태 깔끔하고 너무 좋았어요 가족들 묵기 딱입니다. 직원분들도 친절하시고 리조트앞에 맛집도 있고 편의점 오락실 등 다 있어서 편해요 그리고 산책로가 너무 잘 되어 있어요 바다도 보이고 강정천인지 천도 있더라구요 아침에 산책만 해도 기분이 좋았어요 수영장도 크고 좋아보이던데 마감이라 이용을 못해서 아쉽네요 생각했던 것 보다 너무 만족한 숙소였습니다 
10.0,"리모델링된 프리미어 오션뷰룸 5층에 연박으로 머물렀습니다. 숙박예약전 여러 블로거 글 참고했었고 실제 모습도 블로그 사진과 똑같았습니다. 프런트 직원분들 친절하시고 로비 깨끗하고 쾌적하며 뷰 장난아닙니다. 리노베이트 룸이라서 너~무 깨끗하고 좋았습니다.
산책길도 수영장도 잘되어있고 힐링 그자체였습니다. 제주도가면 또 묵고싶은리조트입니다. 성수기 가격 가성비 생각하면 신라나 롯데 호텔보다 만족도 높고 강추합니다."
10.0,두 개의 룸이 있는 숙소를 예약했고 아주 편안하게 잘 쉬고 왔어요 무료로 제공된 컵라면이 맛있었어요 직원분들이 모두 친절했습니다 애슐리퀸즈에서 먹은 디너뷔페도 괜찮았어요 강정천이 옆에있어서 놀고 싶었는데장마이후라 물이 많아서 놀지 못해 아쉬웠어요 바라는점이 있다면 강정천산책길이 잘 조성되었으면 좋겠고요 천으로 내려가는 안전한 계단이 만들어 졌으면 좋겠어요 다음에 기회가 되면 또 이용하고 싶습니다
10.0,"여기저기 다니다가 저녁늦게 도착했는데
무료로 룸 업그레이드도 해주시고 직원들도 친절하셔서 4가족 2박3일 잘쉬다가 갑니다.
에슐리 조식도 만족스럽습니다~ㅎㅎ
중문 서귀포쪽 관광하기 딱좋네요"
10.0,켄싱턴 리조트의 리뉴얼 객실을 이용했는데 객실 분위기가 밝고 깔끔했습니다. 또 리조트 주위로 예쁜 산책길이 조성돼있어 간단히 걷기 좋았습니다. 객실을 이용하던 중 불편사항이 생겨 연락을 드렸더니 신속하게 해결해주셔서 정말 편안한 투숙이 되었습니다! 친절하고 신속한 해결 감사했습니다:)
10.0,"아이들 데리고 왔어요~
가족 이용하기에 객실 크기 딱 좋구요
방도 업그레이드해 주셔서 리모델링된 객실에 넘넘 편안히 잘 쉬다갑니다
아침 조식포함에 이가격이면 안올이유 없죠^^
주변에 가까운곳 둘러볼 곳도 많고
여름에 또 오고싶네요~~
강추입니다~~"
9.6,"집에서 머무는 시간이 많을것으로 예상되어
장점
1.음식취사가능
2.주위맛집볼것많음
3.친절한직원
4.오션뷰
5.켄싱턴 이랜드라는 느낌 좋음
6.넓직이 주차장
7.호텔주위돌아당기기좋음
단점
1.노후화된시설(손씻는데아래열어보세요 80년대 레트로느낌 캬)
2.지하1층에 부대시설 코인세탁 cu있는데 엘베가없음 1+1은 앞 세븐일레븐에서 구매하시길
3.칫솔이나샤워타올챙기기
4.샴푸가없고 샤워젤(?)로통일이라 머리가
빳빳하게 간지나게 산다라박처럼 세울수있음
5.수건이나 시트갈이는 4일이상 숙박시
2일단위로 해주는데. 3일이라 안타까움ㅎㅎ
그래도 친절 직원덕분에 이점은 해결
여러모로 쨩쨩좋았습니다 ! 
직원분들이 모두 친절해서
바가지인줄알면서도 오메기와 특산품삿음V 짱!"
10.0,블로그 사진보다 룸이 더 커요! 거실도 꽤 크고 방도 2개에 침구도 깨끗 ㅎ 바로 뒤에 산책로 있고 바다뷰 끝내줍니다. 수영장도 꽤 크규요 아기랑 놀기 좋고 제가 더 재밋엇어요 ㅋㅋㅋ 일단 너무 10점이에요 리모델링 햇어서 너무 깨끗해서 좋앗어요ㅠㅠ 직원분들은 5성급 호텧보다 더 친절하셨구요! 음식도 맛나요 ㅎ 숙소 앞 돼지고기집은 짱맛잇 ㅋㅋ 여러모로 또 가려구요!! 감사히 놀았습니당
10.0,회사에서 오게됐는데 리모델링해서 그런지 방도 깔끔하고 직원분들도 너무 친절하시고 2박하는동안 너무 편하게 잘 묵었어요~ 조식도 애슐리 맛있었습니다!!
10.0,오션뷰가 너무 예뻤고 갑자기 추워진 날씨에도  따뜻하게잘지냈어요~~  무엇보다아이들 데려간곳이라 청결이 가장 신경쓰였는데 깨끗해서좋았어요~~ 후기에 화장실냄새  얘기가 있었는데  좀나긴했지만 지내는데 아무문제없었어요~다음에 다시 이용할예정입니다
10.0,"가족 4명이서 여행했는데 눈이 많이와서 제주 구경 많이 못해서 우울했는데 숙소가니 다음날 천천히 체크아웃하라고 무료로 레이트 체크아웃 1시까지 해주시고 룸도 업그레이드해서 오션뷰로 주셨어요 그리고 방에는 컵라면  물  맥주 등 제공해주셨고  4명 커피도 카페에서 먹을수있도록 제공해주셨어요 
너무 친절하고 배려 많이 해주셔서 좋은 기억으로 남을것 같습니다 (처음 숙박 예약 잘못했을때도 친절하게 응대해주셔서 좋았습니다)
숙소도 창가 쇼파에서 예쁜 사진도 많이 찍었습니다. 눈오는 제주도라 많이 지쳤었는데 난방도 딱 적절하고 푹 쉬어서 좋았습니다!!
다음날 나가보니 산책로도 잘되어있고 옆에 계곡도 흘러가고 너무 좋았어요 서귀포오면 또 오고싶어요 !! 날씨가 좋았으면 리조트 시설을 더 많이 누렸을꺼에요~ 잘 쉬고 갑니다♡"
10.0,"제주도 진짜자주가거든요 갈때마다 비싼 호텔에서 숙박하다가 이번에 가족여행으로 가게되면서 리조트로 선택하게됬어요 근데 진짜 생각이상으로 좋았어요 최근에리모델링 해서그런지  깔끔했고 넓고 ㅎ 
뷰도 좋았어요~  직원분들도 친절하셔서 넘 만족하며지냈습니다~!!^^"
10.0,"7월말 아이셋 대리고 가서 머물렀던 리조트입니다. 리모델링 한 룸에서 2박했고  직원도 친절 룸도 깨끗했어요~
수영장도 너무 맘에 들었습니다

거기다 편의점이 바로 지하1층에 있어서 너무 편했어요~
저희 아이들도 또 가고 싶다고 지금도 말해요~

다음에 제주도 또 간다면 여기에서 또 숙박하고 싶네요~"
10.0,"직원분께서 룸컨디션을 업글해주셔서 리모델링된 객실에서 편안하고 쾌적한 1박을 했습니다 청결과 침구에 예민한데 아주 만족스러웠습니다 캡슐커피도 잘마시고 다음에 제주도를 온다면 망설임없이 다시 투숙할 예정입니다
친절하신 대해주신 모든 직원분들께 감사드립니다"
10.0,"거동 불편하신 어머님과
성인  청소년 자녀와 함께한
10년만의 제주 가족 여행에
모두를 만족시킬 만한~~
최고의 숙소 였습니다^^
돌아오자마자 재방문 계획을
잡으려고 일정 확인중일정도로…
다시 가고 싶은 제주신라호텔 입니다"
