score,comment
10.0,사실 별로 기대 안하고 갔어요~ 그런데 인테리어나 편의시설도 모두 너무 안락하고 좋아서 여행을 너무 편하게 했답니다^^ 직원분들도 한결같이 친절하셔서 참 좋았구요~ 가장 좋았던건  관광지(중문)과 올레시장  식당가의 중간쯤 위치해 어디든 가기 좋다는거에요~!!   아! 그리고 이유식 판매하시는 곳과도 가까워서 좋았어요~
10.0,"리모델링 되아 시설 깨끗하고 맘에 들어요 고기도 맛있어요 ^^
"
10.0,할머니 모시고가는 제주도여행이라 엄청 찾아보고 예약했는대 위치 룸컨디션 뷰 모두 흠잡을대가없네요. 화장실 냄새조차 좋아서 너무만족했습니다! 직원분들도 엄청친절하세요 ㅎㅎ제주여행가실분들은 꼭 방문해보세용😀
10.0,"위치 나쁘지않고 외관에 비해 약간 노후되긴 했으나 가격이 저렴해서 이해되는 부분이었습니다
7명이 사용하기에 좁지도 않았고 이불도 넉넉하게 주셔서 좋았습니다."
10.0,"가족여행숙소로
최고에요
조식맛있고 C동 리모델링되서 깨끗하고
월컴푸드로 컵라면배치 되어있어좋았어요
리조트맞은편
두가시의부엌에 갈치조림도
맛있어요"
9.2,9월 이용 후 넘 쾌적해 11/27 숙박때 아고다를 통해 다시 이용했는데요  아고다에서는 수리 안된 예전 스타일 방을 예약했는데 체크인시에 프론트에서 수리완료 방들의 여유가 있다고 무료 업글해주셨어요. 수시로 불편한 점 없는지 체크해주시고요 .  직원분들의 친절도는 정말 엄청난 레벨이고요   정원 및 산책하기도 좋고 한라산이 바라다보이는 뷰도 너무 만족하는 곳이에요 ! 강추합니다 ! 
9.2,"아기와 첫 여행인데 조금 급하게 내려왔는데 온돌방 호텔을 찾아서 골랐어요! 
운좋게 신관으로 업그레이드해주셔서 지내는동안 잘 보냈습니다
전자렌지만 있으면 되서 편하게 사용했어요!
침대가 3개였고  아기가드가 없어 이불세트를 무상으로 제공해주셔서 이불펼쳐서 재웠습니다!
산책로가 잘 되어있어서 아침에 산책하고 외출했어요! 아기가 큰 창이 있어서 엄청 좋아했어요🤗 다음에 또 간다면 이용하고싶어요!"
10.0,숙소깨끗하고조아요
10.0,와 리조트 호텔 많이 다녀봤지만 당연 최고입니다. 시설 리뉴얼 되어서 너무 좋았고 조경이 남달라 둘러보는 재미가 쏠쏠합니다. 애슐리와 편의점이 시설 내에 있어 편리합니다. 중문과 멀지않고 올레시장에서 가까워 위치도 훌륭합니다. BBQ도 맛있어 보이네요. 직원분들도 매우 친절하십니다. 여기 적극 추천합니다.
10.0,"제주 여행의 숙박은 위치와 시설 환경이 가장 중요한 선택사항이다.
가족과 함께 이동하며 즐기는 여행이라 제주도 전역을 이동하기에 서귀포는 매력적인 곳임에 틀림없다.
이곳에 대기업이 운영하는 리조트라면 더더욱 믿을만하지 않을까?

예전과 다르게 리뉴얼된 리조트는 너무 너무 깔끔한 미니멀을 실천할 수 있는곳이었다.

내부에 들어가자 마자 느낀것
1.깔끔한 거실과 큰 TV에 청결함마저 선물 받았고
2. 취사용이 없는 방을 선택하여 음식냄새 제로
3. 하지만 식기류가 준비되어있고 인스턴트식품은 OK
4. 안방의 통창으로 시야감이 너무 좋고 아내가 대만족
5. 밤에 별보며 얘기 나누기 너무 좋아요
6. 침구류는 호텔처럼 평안해서 온몸을 감싸는 따뜻함과 포근함을 느껴요
7.잘 정비된 정원에서의 산책
8.멀리가지 않아도 리조트내에서 제주흑돼지도 즐길 수 있어요
9.전기차 충전도 되니 찾을 필요도 없고요
10.더욱이 주위에 유명관광지 이마트 스타벅스 등 편의시설이 즐비하죠

이런곳인데 추천 하지 않을 이유가 단한가지도 없네요
강추 합니다. 켄싱턴리조트 서귀포점.... 직원들 친절은 덤이에요"
10.0,친절하시고 위치도 좋아요!
8.4,"크로나 이후  첫 가족여행 이었는데 시설도  깨끗하고  주의에 편의시설이 많아 편히 여행을 했네요.
다음에 제주 올 때도 예약 할 생각 입니다^^"
9.2,최근에 리모델링을 해서 깨끗하고 뷰도 좋습니다. 
6.4,생일 기념 가족여행으로 갔어요. 리뉴얼 전 숙소로 예약했는데 무료로 리뉴얼된 숙소로 업그레이드해 주셔서 감사했어요. 직원분들 친절하시고 리조트  숙소 자체가 아주 깨끗했습니다. 아이가 아쉬운지 다음에 또 오자고 이야기하네요. 잘 쉬다가 왔습니다.^^
8.8,음 이번 여행은  켄싱턴   한림  서귀포  둘다 갔다왔어요   둘다 가성비 좋은곳이지만  서귀포 켄싱턴은   직원 분들 진짜 친절하시고 주변  갈곳도 많고 숙소 상태도  괜찮앗어요   
8.8,마운틴뷰로 한라산이 오른쪽으로 비스듬이 보이는 풍경으로  방 2개에 하나는 더블 침대이고 하나는 트윈 침대가 놓인 방이었어요. 거실도 넓고 깨끗해서 만족했습니다. 조식이 가격대비 좋았구요 지하에 편의점이 있어서 사용이 편리했어요. 하나 불편한 것은 욕실이 좀 작더라구요.  
10.0,"엄마 아빠의 결혼기념일 기념 여행으로 제가 대신 예약 해드린 숙소예요. 이모  할머니와 함께 다녀오셨는데 상당히 만족하고 기쁜 마음으로 돌아오셔서 후기 남깁니다.

우선 추가 이불을 무료로 제공해주신 점  카페가 닫았음에도 불구하고 문의드렸을 때 라떼를 제공해주신 점  마운틴뷰를 오션뷰로 변경해주신 점  근처의 노래방과 식당도 친절하게 안내해주신 점  콜했을 때 바쁜 이유를 설명하고 바로 콜백해주신 점 등 누군가는 번거로울 수 있는 요청들을 친절하게 응대해주셔서 감사드립니다.

그 외에도 다른 곳을 가지 않고도 산책도가 잘되어 있어 너무 좋으셨다고 하시네요!

저희 가족분들에게 행복한 추억과 기억을 남겨주셔서 진심으로 감사드립니다.

나중에도 꼭 다시 방문하실 거라고 재차 말씀하시네요 :) 

가족분들과 좋은 경험을 하시고 싶은 분들께 완전 추천드립니다!!!!"
8.0,"우선 리모델링 룸 너무 쾌적하고 뷰가 끝내줍니다..! 위치도 좋고 4인 가족 너무 즐겁게
보내고 왔습니다!"
7.2,숙소 리모델링되어서 전보다는 나아요! 사진보다는 작은느낌이고 엄청 달라진 느낌은 못받았습니다~ 주변 산책도 괜찮긴한데 산책로가 잘조성되어있진 않아요ㅎㅎ 객실 청결상태도 그럭저럭했구요! 조식은 별로 였습니다.. 8시쯤 부터는 음식을 채우지는 않더라구요 흠.. 평일이라 그런건지... 다른 호텔과는 다르게 방이 분리되어있어서 좋은데.. 그거 말고는..
8.4,"가족과  편안한 제주 여행  다녀 왔어요
숙소내 애쉬리 부페나 저녁BBQ도 좋았습니다
직원분들도 친절하셨어요"
10.0,가족들하고 여행와서 편하게 이용했어요 시설도 너무 깔끔하고 깨끗했어요 직원분들도 친철하시고 편의시설이 많아서 좋았어요 담에번에도 다시 재방문 의사 있습니다 편히 쉬고 놀다 왔습니다 ㅎㅎ
9.6,"학교동기들과 셋이 함께 머물고왔는데. 리조트 조경 넘 이뿌고 리조트 입구에 한라산뷰. 숙소내에서 보이는 바다 풍광이 외부 일정 취소하고 머물고 싶을 정도로 흡족했어여~
유리컵 한 개 깨뜨려서 체크아웃할때 말씀 드렸더니  다친곳 없는지 먼저 물어주시는 직원분 응대에 넘 감동했어여~~"
4.0,"도착한날이 추웠는데  난방이 안됨  중앙난방이라 20시 부터 난방된다고 함. 온풍기를 지급받았으나  방안이 너무 건조해졌음. 가습기는 없다고 함.
또한  침대 가드가 없어  유아동반이었는데 침구류를 줬음. 근데  바닥이 차가워서 아이를 재울수도 없었음. 너무 추웠던 기억만.."
10.0,더 친절하고 좋아졌네요~
10.0,예약하고 친구들 데리고 갔는데  모두들 숙소 잘 잡았다고 칭찬했네요. 깔끔하고 깨끗하고 직원들도 엄청 친절해요. 별 다섯개
10.0,애들이랑 제주도 여행 잘하고 왔어요. 깔끔
6.8,가격만큼입니다
9.2,전체적으로 만족스러운 숙박이었습니다. 서귀포 중에서도 안쪽으로 좀 들어가야 해서 어디 가려면 이동시간이 좀 걸린다는 단점이 있지만  이외에 주변풍경이나 호텔 부대시설 (식당  스파  편의점 등)은 좋았습니다. 특히 저희가 예악한 방은 리모델링한 방이라 매우 깔끔해서 좋았습니다. 숙박 고민 중이라면 리모델링한 방 추천합니다.
9.2,"6인이 숙박.
6명이 쉴수 있는 방은 리모델링이 되어 있지 않아 룸이 세월의 흔적이 많이 있음.
그러나 숙소 위치가 좋아 밤에 파도소리 들으며  잘 쉬다 옴.
직원들 친절해서 좋았고 조식이 1층 애슐리에서 진행되서 만족함"
9.6,조식 짱  가성비 짱  위치도 나름 중문과 가까움  먹을 곳은 직원이 몇군데 추천해주었음. 회사에서 이용했는데 아주 만족들 하였음
10.0,조식짱. 친절 짱. 위치 짱. 가성비 짱
9.2,다음에도 이용할께요
9.6,리모델링해서 깔끔하고 방에 전자레인지랑 식기도 있어서 편하고 좋았어요. 방에서 바다도 잘보여요~
8.0,주변에 산책하면서 바닷가도볼수있고 멋진계곡도있어서 가족단위여행에 아주 좋아요 
10.0,조용하고 좋아요
10.0,직원분들도 넘 친절하시고 숙소도 넘 깨끗해서 잘 머무르고 왔습니다~지인분들어게도 추천 많이 하도록 할게요^^
10.0,"숙소 리모델링 되어서 시설이 좋습니다
"
8.4,오랫만의 제주도여행이 친절한 직원 덕분에 기분좋게 시작을  하였고 리뉴얼을해서 숙소도 깨끗해서 잘 쉬고 왔습니다 서귀포쪽으로 숙소를 잡으신다면 캔싱턴 적극추천합니다
10.0,방이 정말 넓어요. 기본 조리시설도 있고.. 식탁이 있다보니 뭐 사와서 먹기도 좋았어요. 오래된 곳이라서 시설이 아주 깨끗하고 정갈한 느낌은 아니지만 일단 방이 아주 넓어서 좋았습니다. 수건도 넉넉하게 주시고요
9.6,"2박 3일동안 잘다녀왔습니다.  리조트 위치가 너무 좋고  앞에 조경도 잘해놓아 아침 저녁 산책하기도 넘 좋았습니다.  편안하고 직원들도 친절했습니다.
조식은 리조트내에 있는 애슐리에서 먹었는데 맛있고 깔끔하기도 했고 천장이 높아서 그런지 분위기도 좋았던것 같습니다.
제주 서귀포 켄싱턴은 2번째 방문했는데  다음에와도 여기서 2박은 꼭 할 것 같습니다."
8.0,가성비굿
9.2,"처음 주차할때 건물외관때문에 예약한곳이 아닌가 헷갈렸었습니다.

이후 체크인을하니 리모델링한동이 따로 있더라구요
내부는 정말깔끔하고 서비스도 정말 좋았습니다. 직원분들이 친절하셔서 더 좋았네요

조식도 먹었는데 애슐리퀸즈에서 조식먹는거라 음식도 만족스러웠습니다. 주차장쪽말고 반대쪽 뷰는 정말 좋네요 "
10.0,친구들과 가기 좋은 곳 
8.8,미취학애들을위한시설이 잇엇으면 좋게네요  대체적으로 서비스 서설 좋앗어요
8.8,"36개월/ 11살/ 아이들 데리고 다녀왔어요. 먼지 알레르기가 있어 숙소 고르기 힘든데 숙소가 너무 깨끗하고 넓어서 편히 쉴 수 있었고 식기류도 깨끗하고 제주에일 2캔/ 컵라면/카페 음료 쿠폰 4장 챙겨주셨어요
12월에 또 가려고요

쏘카 가능지역입니다."
8.0,"켄싱턴 오랜 이용자로서 한마디만 합니다.
그리춥지않은 지금도 방이 냉골인데  도대체 난방은 하는건지...
여름에는 에어컨 바람세기는 왜  시원찮은지 ...
지금같은 환절기에는 적어도 방바닥이 미지근이라도 하게 해줘야 하겠지요.
개선 바람니다."
8.8,"인원수가 많았는데도 편하게
묵었어요
시설은 노후되긴했는데 잠만 자고
나와서 괜찮았어요
다음번엔 리모델링 된 방에서 묵으려고 해요"
10.0,"객실 내부 도 깨끗하고 직원분들도  매우 친절하셨어요
앞으로 제주여행 숙소는 켄싱턴 서귀포로 할거예요~~"
6.8,.
10.0,다음에 또 방문할 의향있습니다.
9.2,"이번 숙소 정하면서
설레이는 잠시
직원들ㅇ.ㅣ 친정함과 따뜻한
숙소의 위치와 상태까지 맘에 딱 들어어요^^"
8.0,직원분들 모두 친절하시고 리노베이션 룸 기준 방 컨디션 매우 좋습니다.
8.4,여름에 수영하기 좋습니다.
9.6,"아이들과 총 5명이 묵었던 제주여행 이틀째  숙소
친절함 숙소 외부 사진찍기좋은 외관  뭐하나 부족함 없는 숙소였네요
다음에 제주여행가면 또가고싶은 숙소에요"
10.0,남자친구와 엄마와 셋이 가게 된 첫 숙소였는데 너무 깔끔하고 위치도 너무 좋았습니다 모두가 만족한 숙소였어요
10.0,위치가 중문 관광하기에 아주 좋아요. 해변가라 제주 바다를 즐기기도 환상적
9.6,무엇보다 깔끔하고 객실에서의 바다뷰는 너무 좋았어요
8.0,그럭저럭
8.0,좋음
6.4,그럭저럭
7.6,별로
6.4,"좋음
"
9.2,"공홈보다 저렴하게 잘 잡았고 
리뉴얼 객실 깔끔하고 산책로도 있고 
여러모로 좋은 가격에 잘 쉬었습니다:)"
8.4,"아이들과 함께한 여행에서 숙박을 선택했는데 너무 만족했습니다.
저녁 산책길도 너무 좋았고  5층에 자리가 있어 배정이 되었는데 바다가 보이는 뷰로    아침에 일어날때마다 풍경에 반했어요.
아이가 다음에 또 여기 오면좋겠다고 해서 저도 기분이 좋았습니다. 
"
8.8,가격대비 너무 훌륭한 숙소라 추천합니다
7.2,주변시설 등 좋으나  호텔이 오래되어 좀 낡았음.  천장조명이 조만간 떨어질 거 같은 느낌
9.6,방이 두개여서 좋았고 오션뷰가 너무 멋있었어요! 직원도 친절하시고 아래 카페  편의점 등 부대시설이 잘 갖춰져 편리했어요!
10.0,완전 깨끗하고 좋습니다
10.0,"바람이 불어 불멍존은 진행하지 않았고  보수로 인해 사우나도 이용은 못했지만 ㅠㅠ 그외에 다른 건 모든게 완벽했습니다. 
리뉴얼 된 객실이라 깨끗하고 좋았습니다."
10.0,"부족함없이 최고였습니다
가성비 짱이였어요 리뉴얼된 곳에 2박 보냈는데 당연 깨끗하고 편안했습니다
직원분들도 친절했어요~^^"
8.8,"11개월된 아이와 첫 제주여행하는거라 숙소를 어떻게 할까 고민하다 3박4일 일정 모두 한 곳에서 지내자 하고 결정한 켄싱턴!

방2개에 거실이 있어 아이 일찍 재워 놓고 남편과 맥주한잔 하기도 좋았고 시설도 깨끗해서 아주 편하게 잘 쉬다왔어요.

아이와 함께 하는 여행에는 특히 추천합니다!!"
10.0,"켄싱턴 만한곳없네요
특히 서귀포
객실 리뉴얼되어서 너무좋고요
직원들이 너무 친절합니다
리조트안 산책로도 넘 잘되어있어요
곳곳에 귤 천혜향나무가 많아서 신기하고여"
10.0,"직원분들도 친절하고 아이와이용하기도 편했어요
리뉴얼된곳은 방2개에 너무깔끔하고 뜨거운물도 잘나오고 객실만족도 100프로예요^^
"
10.0,잘다녀왔습니다.  주차장도 넓고 조용해서 좋았어요
8.4,객실이 생각보다 관리가 잘되어 있어 깨끗하고 좋았습니다.
8.8,시설이 많이 노후되긴 했지만 위치와 직원분들의 서비스가 정말 좋아 가성비로 좋은 숙소입니다.
10.0,"리뉴얼 객실이라 깨끗하고
가격대비 매우 만족스러웠어요"
10.0,"룸컨디션 좋고 친절하세요
부모님이랑 아이가 더좋아하네요 

재방문의사 있어요"
6.8,"아쉬운 점이 많습니다.
추석 성수기 가격생각하면 그러려니 하는데   

수건이 외 어떠한 물품제공이 없으니 챙겨가시구요.
온돌방의 경우는 컨디션이 오래된 빌라 인테리어 안한 느낌같으니 참고하고 가셔야 합니다.후기가 잘 없는 이유를 알겠더라구요.

부모님 온돌 좋아해서 했건만 아쉽습니다. 

끝방에 베란다가 없는 방이 있으니 꼭 확인해서 체크인 하시길 바랍니다. (환기가 안됩니다)

여름에 온돌방 예약시 에어컨이 거실에만 있어서 
더울것 같습니다. 추석 연휴 선선한 날씨였음에도 
온돌예약의 방1 은 더워서 잠들기 힘들었습니다. "
10.0,제주도 여행때문에 검색으로 찾아본 숙소였는데 가족4명이 사용하기에 정말 깨끗하고 위생도좋고 전자레인지와 포트기도있어서 사먹고 해먹는데 좋았습니다. 체크아웃 시 짐도 차로옮겨주시고 서비스도 너무좋았습니다. 너무 만족했고 다음에도 이용하고싶습니다.
9.6,"아이들과 여행다닐때   숙소찾기가 정말 힘든데
가격대비 호텔  조식 포함해서 잘 쉬었다 갑니다.

서귀포쪽 맛집도 많아서  추천합니다"
8.8,"리모델링 방으로 업그레이드 해주셔서 정말 감사합니다 오션뷰방에서 묵었는데 큰방에서 찍은 밖에 뷰가 외국온줄알았어요 인생사진 건졌어요
담번에도 제주도오면 또 오고싶은숙소에요
로비 직원분도 너무 친절하셨어요"
9.6,"리모델링 해서인지 깔끔해서 좋았어요.
애슐리나 카페. 키즈라운지가 가까이 있어서 아이들과의 여정에 도움이 많이 됐네요.
 지하 편의점의 삼각김밥같은 간편식은 종류와 양이 적었고 폭이 좁은 주차공간은 다소 아쉬웠네요.
"
9.6,"여행일정변경으로 급하게 잡은 숙소였는데 프론트 직원분(성함이 조은설님이였는데)넘 친절하시고 객실도 청결해서
가성비 넘 만족스러운 숙소였어요~
앞날  신화월드 서머셋에서 지내다 넘어온건데
다들 거기보다 켄싱턴이 더 좋다며~~
재방문의사 10000%로 완전 강추합니다."
10.0,"위치좋고 가격대비 숙소도 깨끗하고 좋습니다
수영장은 작아요"
10.0,"이번에 리모델링해서 룸 컨디션 좋았어요. 조식/석식은 맛도 있고 제주도 물가대비 저렴하다고 느껴졌어요.(스테이크 추가해서 꼭 드세요)
시원한 뷰도 좋고  야간에 저녁 먹고 산책길도 참 좋았어요. "
9.2,리모델링 한곳으로 예약했는데  화장실은 좁지만 그 외에 침대나 룸컨디션  미니바 1회 무료 이용  지하 편의점  주차장  침대방 뷰! 친절하신 직원분들 너무 다 만족해서 다음 여행때 꼭 다시 묵을거에요.
9.2,renovated room 상태 좋습니다.
9.6,제일친한 찐친과 신랑없이 아이들을 데리고 무작정 떠났던 여행이였는데 숙소 검색부터 급하게 결정된거라 걱정이 많았지만  막상 켄싱턴리조트로 결정하고 도착해보니 너무 좋더라구요 룸도 께끗하고 조식도 정말 맛있어서 아이들도 잘 먹고 덕분에 친구와 우정도 쌓고 자녀들과 더욱 가족애를 느꼈던 뜻깊은 여행이였습니다  
8.4,"친구들의 강력한 요청으로 리뉴얼 오션뷰를 예약했습니다! 

큰방1 원베드  작은방1 투베드로 4명이 묵기에 딱 좋았고 거실도 넓고 전체적으로 붐비는 느낌 없이 좋았습니다. 작은방엔 에어컨이 없어서 필요시 선풍기를 대여해주는데 저흰 대여안하고 거실 에어컨으로 온도 맞추고 잤어요. 더위 많이 타시는 분들은 큰방에서 자거나 선풍기 대여하세요! 

샤워배수 잘 되는지 꼭 확인해보고 씻으시고 문제있을 시 프론트 전화하면 오셔서 해결해주십니다! 

전자렌지  커피포트  캡슐커피머신은 있는데 정수기는 숙소내에 없어서 생수 챙겨오시는게 좋아요!
수저세트  앞접시  작은칼은 있는데 가위가 없어서 조금 불편했어요(생각보다 가위를 많이 찾게 되더라구요ㅜ) 그래도 조리가 아닌 사온걸 먹는거라 문제는 없습니다!

미니바에 준비된 특산 라면도 한번먹어보고 싶었던거라 기분좋게 먹을 수 있었어요!

침대는 살짝 딱딱한편이고 베개는 두개있는데 낮고 높아요ㅜ 예민하신분들은 참고해주시고. 저는 낮은베개 두개로 베니까 괜찮았어요!

9월이라 수영장은 운영안했는데 날씨가 미친듯이 뜨거워서 9월도 운영해도 될 것 같다는 아쉬움이 많이 남았어요ㅜ 사우나 시설도 리모델링 중이라 이용이 불가능했는데 제반시설 이용 생각 있으신 분들은 확인해보시고 예약하시면 될 것 같습니다.

프론트 보시는 직원분들이 굉장히 친절해서 뭘 물어볼때도 부담이 없었고 요청하기 전에 알아서 챙겨주시는 부분들도 참 좋았습니다!

프론트옆에 기념품샵이 있는데 관광지 돌면서 봤던 상품들이긴 하지만 가격이 비싸지않아서 친구들이랑 엄청 쟁였습니다🤭🤭 우도땅콩로쉐는 너무 맛있어서 다른데서도 찾아봤는데 잘안보이거나 비싸더라구요ㅜㅜ 전체적으로 비싸지 않으니까 퇴실하기전에 미리 구매해서 캐리어 싸는 것도 추천드립니다.

친구들끼리 숙소비를 나눠서 내니까 가격면에 부담이 적어서 가성비도 좋고 이용 하는동안 전체적으로 만족하는 숙소였습니다. 직원분들 친절 최고입니다!👍👍"
10.0,리모델링 한 곳으로 배정받아서 이용했는데 그전보다 훨씬 깔끔해지고 에어콘도 좋아진것같아요^-^ 직원분들도 너무 친절하시고 특히 조식이 애슐리 퀸즈라서 저렴한가격에 맛있게 먹었어요^-^ 
10.0,"직원분들도 친절하게 룸상태더 너무 좋았습니디 1박
푹 쉬다 기분좋게 갔습니다!"
10.0,"만나는 모든 직원분들은 친절하셨으며
평일이어서 오션뷰로 업그레이드를 먼저 제안해주셔서 좋은 풍경을 보며 숙박할 수 있었습니다.
저녁에 리조트 내 바베큐를 이용했는데
가는길에 조경도 예쁘게 잘되어있고 식사도 모두 만족스러웠습니다."
8.4,제주공항에서 버스로 80분 거리에 있는 조용한 숙소. 한라산에서 흘러내리는 강정천과 악근천(岳近川)이 앞뒤로 흐르고 바닷가에 면해 있어 산과 바다를 함께 조망할 수 있으며  풀장을 포함한 넓은 정원이 조성되어 있어 산책하기 좋음.  뷔페식 아침 조식도 즐길 수 있음. 
9.6,"원래 예약했던 방을 리뉴얼 된 객실로 업그레이드해 주셔서 더 더 잘 쉬고 왔습니다!!
직원들도 정말 친절합니다~~!! 
다음 여행 때도 이쪽을 여행한다면 다시 오고 싶은 곳입니다~"
8.8,아주깔끔하고 객실이 좋습니다
6.0,가격이 점혐하고 리모델링해서 좀 기대했는데.. 청결  쾌적성은 좀 떨어져요. 가격대비 숙박인원은 가성비 좋긴합니다
10.0,"중문쪽 관광지와 가깝고
정원이 너무나 아름답고
직원분들이 친절했습니다
거실까지 있어서 참 좋았습니다
침대는 편했고 뷰도 좋았습니다.
층간소음이 좀 있었으나 전반적으로 만족하는 숙소였습니다"
8.0,숙소가 약간 오래된 느낌은 있지만 아이와 함께 가족여행하기에는 나름 괜찮은 숙소입니다 
8.8,"온돌방  더블베드 방2개에 거실도 별도로 있어서 
2가족이 편하게 있다가 왔어요~
프론트 직원들도 넘 친절하시고  
특히 저녁으로 애슐리 뷔페 이용할수 있어서 좋았어요."
8.4,리뉴얼된 객실로 업그레이드 해주셔서 쾌적한 환경에서 편하게 잘 쉬었다 왔습니다~직원분들도 친절했습니다~감사합니다
9.6,편하게 잘 쉬고 갑니다
10.0,직원분들 친절 시설깨끗 주차장넓음 관리잘된정원 산책로 아이들이 있는 가족에게 너무좋아요. ^^
10.0,가족여행으로 제주도 와서 켄싱턴리조트 하루밤 묵었습니다~ 직원분들 너무 친절하시고 리뉴얼된 방으로 바꿔주셔서 너무 편안하고 쾌적하게 머물다 왔습니다~!
9.6,가격대비 시설도 좋고 가족단위로 오기 좋습니다
9.6,리뉴얼돼서 룸컨디션 좋고 친절합니다. 무엇보다 리조트 산책하면서 강정천 물소리와 파도소리를 동시에 느낄수 있는 게 가장 마음에 듭니다. 애슐리 조식은 전반적으로 좋은데 한식 종류는 좀 아쉽네요 그리고 수영장이 8.31. 까지만 운영이라 이용을 못해봐서  부대시설에서 별하나 뺀 만점입니다. 재방문의사 100%
8.8,"두번째 방문인데요. 오션뷰 마운틴뷰 다 이용해봤는데저는 마운틴뷰가 훨씬더 좋았습니다 날씨가 좋으면 기억에 남을만큼 뷰가 정말 최고입니다 . 다만 침대는 바닥에 자는 것보다 딱딱해서 조금 불편합니다 . 
샤워용품도 넉넉히 잘 갖춰져있어서 편했습니다."
